,usageclass,checkouttype,materialtype,checkoutyear,checkoutmonth,checkouts,title,isbn,creator,subjects,publisher,publicationyear
2326,Digital,OverDrive,EBOOK,2018,1,10,A Well-Crafted Home: Inspiration and 60 Projects for Personalizing Your Space,,Janet Crowther,"Crafts, Home Design & Décor, Nonfiction","Random House, Inc.",2017
2334,Digital,OverDrive,EBOOK,2018,1,2,The Edwardians,,Vita Sackville-West,"Classic Literature, Fiction, Literature","Random House, Inc.",2017
2339,Digital,OverDrive,EBOOK,2018,1,13,Mrs. Osmond: A novel,,John Banville,"Classic Literature, Fiction, Historical Fiction, Literature","Random House, Inc.",2017
2349,Digital,OverDrive,EBOOK,2018,1,2,"Shocking True Story: The Rise and Fall of Confidential, ""America's Most Scandalous Scandal Magazine""",,Henry E. Scott,"History, Language Arts, Nonfiction, Sociology","Random House, Inc.",2010
2351,Digital,OverDrive,EBOOK,2018,1,4,The Perks of Being a Wallflower,,Stephen Chbosky,"Young Adult Fiction, Young Adult Literature","Simon & Schuster, Inc.",2014
2362,Digital,OverDrive,EBOOK,2018,1,2,Eva Luna: A Novel,,Isabel Allende,"Fiction, Literature, Romance","Simon & Schuster, Inc.",2015
2363,Digital,OverDrive,EBOOK,2018,1,2,George Washington: The First President,,Sarah Albee,"Biography & Autobiography, History, Juvenile Nonfiction, Language Arts",HarperCollins Publishers Inc.,2017
2369,Digital,OverDrive,EBOOK,2018,1,1,Paris: Your Guide to the 10 Best of Everything,,Mike Gerrard,"Nonfiction, Travel",Dorling Kindersley Limited,2006
2374,Digital,OverDrive,EBOOK,2018,1,1,"The Shadow Thieves: The Cronus Chronicles, Book 1",,Anne Ursu,"Juvenile Fiction, Mythology","Simon & Schuster, Inc.",2014
2375,Digital,OverDrive,EBOOK,2018,1,1,"Cat Coming Home: Joe Grey Series, Book 16",,Shirley Rousseau Murphy,"Fiction, Mystery",HarperCollins Publishers Inc.,2013
2381,Digital,OverDrive,EBOOK,2018,1,2,"Black Lies, Red Blood: Ann Lindell Series, Book 5",,Kjell Eriksson,"Fiction, Mystery",Macmillan Publishers,2015
2383,Digital,OverDrive,EBOOK,2018,1,6,History Is All You Left Me,,Adam Silvera,"Romance, Young Adult Fiction, Young Adult Literature","Random House, Inc.",2017
2385,Digital,OverDrive,EBOOK,2018,1,3,"In the Best Families: Nero Wolfe Series, Book 16",,Rex Stout,"Fiction, Mystery, Suspense, Thriller","Random House, Inc.",2012
2406,Digital,OverDrive,EBOOK,2018,1,2,Princesses Behaving Badly: Real Stories from History Without the Fairy-Tale Endings,,Linda Rodriguez McRobbie,"Biography & Autobiography, History, Nonfiction","Random House, Inc.",2014
2416,Digital,OverDrive,EBOOK,2018,1,1,"Decoding the Universe: How the New Science of Information Is Explaining Everything in the Cosmos, fromOur Brains to Black Holes",,Charles Seife,"Nonfiction, Science","Penguin Group (USA), Inc.",2008
2424,Digital,OverDrive,EBOOK,2018,1,14,"The Brightest Fell: October Daye Series, Book 11",,Seanan McGuire,"Fantasy, Fiction","Penguin Group (USA), Inc.",2017
2426,Digital,OverDrive,EBOOK,2018,1,5,Turn the Ship Around!: A True Story of Turning Followers into Leaders,,L. David Marquet,"Biography & Autobiography, Business, Military, Nonfiction","Penguin Group (USA), Inc.",2016
2427,Digital,OverDrive,EBOOK,2018,1,1,A Tap on the Window,,Linwood Barclay,"Fiction, Suspense, Thriller","Penguin Group (USA), Inc.",2013
2438,Digital,OverDrive,EBOOK,2018,1,1,"Watergate: The Hidden History: Nixon, The Mafia, and The CIA",,Lamar Waldron,"History, Nonfiction",Lightning Source Inc,2017
2440,Digital,OverDrive,EBOOK,2018,1,1,Warren Buffett's Ground Rules: Words of Wisdom from the Partnership Letters of the World's Greatest Investor,,Jeremy C. Miller,"Business, Finance, Nonfiction",HarperCollins Publishers Inc.,2016
2445,Digital,OverDrive,EBOOK,2018,1,3,"Debt of Honor: Jack Ryan Series, Book 8",,Tom Clancy,"Fiction, Thriller","Penguin Group (USA), Inc.",2010
2446,Digital,OverDrive,EBOOK,2018,1,1,The Baby Firebird,,Paula Harrison,"Juvenile Fiction, Juvenile Literature, Mythology","Simon & Schuster, Inc.",2017
2457,Digital,OverDrive,EBOOK,2018,1,7,"Murder in the Mews: Hercule Poirot Series, Book 17",,Agatha Christie,"Fiction, Mystery",HarperCollins Publishers Inc.,2006
2458,Digital,OverDrive,EBOOK,2018,1,5,"Accidental Sire: Half-Moon Hollow Series, Book 6",,Molly Harper,"Fantasy, Fiction, Romance","Simon & Schuster, Inc.",2017
2459,Digital,OverDrive,EBOOK,2018,1,1,"The Art of Deception: Lou Boldt/Daphne Matthews Series, Book 8",,Ridley Pearson,"Fiction, Suspense, Thriller","Hachette Digital, Inc.",2010
2460,Digital,OverDrive,EBOOK,2018,1,1,War Music: An Account of Homer's Iliad,,Christopher Logue,"Fiction, Poetry",Macmillan Publishers,2016
2461,Digital,OverDrive,EBOOK,2018,1,1,Plastic Surgery Without the Surgery: The Miracle of Makeup Techniques,,Eve Pearl Emmy Award-Winning Celebrity Makeup Artist,"Health & Fitness, Nonfiction, Self-Improvement","Hachette Digital, Inc.",2009
2463,Digital,OverDrive,EBOOK,2018,1,1,Accidental Mistress,,Junko Okada,"Comic and Graphic Books, Fiction, Romance",SOFTBANK Creative Corp.,2011
2466,Digital,OverDrive,EBOOK,2018,1,23,Right Behind You,,Lisa Gardner,"Fiction, Mystery, Suspense, Thriller","Penguin Group (USA), Inc.",2017
2470,Digital,OverDrive,EBOOK,2018,1,6,The Beautiful Ones: A Novel,,Silvia Moreno-Garcia,"Fantasy, Fiction, Historical Fiction, Romance",Macmillan Publishers,2017
2475,Digital,OverDrive,EBOOK,2018,1,1,Brain Jack,,Brian Falkner,"Science Fiction, Science Fiction & Fantasy, Young Adult Fiction, Young Adult Literature","Random House, Inc.",2010
2478,Digital,OverDrive,EBOOK,2018,1,4,"The Lady of the Lake: The Witcher Saga, Book 5",,Andrzej Sapkowski,"Fantasy, Fiction, Historical Fiction, Thriller","Hachette Digital, Inc.",2017
2480,Digital,OverDrive,EBOOK,2018,1,4,Gulag: A History,,Anne Applebaum,"History, Nonfiction, Politics","Random House, Inc.",2010
2484,Digital,OverDrive,EBOOK,2018,1,1,At the Edge of the World: The Heroic Century of the French Foreign Legion,,Jean-Vincent Blanchard,"History, Nonfiction",Bloomsbury USA,2017
2488,Digital,OverDrive,EBOOK,2018,1,1,"Reckless: Thoughtless Series, Book 3",,S.C. Stephens,"Fiction, Romance","Simon & Schuster, Inc.",2015
2491,Digital,OverDrive,EBOOK,2018,1,1,Magnolia Dawn,,Erica Spindler,"Fiction, Romance","Harlequin Enterprises, Ltd.",2015
2492,Digital,OverDrive,EBOOK,2018,1,1,Blessed Are the Cheesemakers,,Sarah-Kate Lynch,"Fiction, Humor (Fiction), Literature","Hachette Digital, Inc.",2012
2504,Digital,OverDrive,EBOOK,2018,1,2,"Pure Food: A Chefs Handbook for Eating Clean, with Healthy, Delicious Recipes",,Kurt  Beecher Dammeier,"Cooking & Food, Essays, Nonfiction",Lightning Source Inc,2016
2515,Digital,OverDrive,EBOOK,2018,1,3,The Magus,,John Fowles,"Classic Literature, Fiction, Literature","Hachette Digital, Inc.",2013
2517,Digital,OverDrive,EBOOK,2018,1,3,"Love Wins: A Book About Heaven, Hell, and the Fate of Every Person Who Ever Lived",,Rob Bell,"Nonfiction, Religion & Spirituality",HarperCollins Publishers Inc.,2011
2521,Digital,OverDrive,EBOOK,2018,1,1,"Hush Now, Don't You Cry: Molly Murphy Series, Book 11",,Rhys Bowen,"Fiction, Historical Fiction, Mystery",Macmillan Publishers,2013
2549,Digital,OverDrive,EBOOK,2018,1,2,"Talk to the Hand: The Utter Bloody Rudeness of the World Today, or Six Good Reasons to Stay Home and Bolt The Door",,Lynne Truss,"Essays, Humor (Nonfiction), Nonfiction","Penguin Group (USA), Inc.",2013
2550,Digital,OverDrive,EBOOK,2018,1,1,Nuevas aventuras de Paddington,,Michael Bond,"Classic Literature, Juvenile Fiction, Non-English Fiction","Editorial Planeta, S.A.U.",2017
2553,Digital,OverDrive,EBOOK,2018,1,3,Who Was Alexander Hamilton?,,Pam Pollack,"Biography & Autobiography, History, Juvenile Nonfiction, Politics","Penguin Group (USA), Inc.",2017
2563,Digital,OverDrive,EBOOK,2018,1,3,R Is for Robot: A Noisy Alphabet,,Adam F. Watkins,"Juvenile Fiction, Picture Book Fiction","Penguin Group (USA), Inc.",2015
2564,Digital,OverDrive,EBOOK,2018,1,3,"Victory of Eagles: Temeraire Series, Book 5",,Naomi Novik,"Fantasy, Fiction, Historical Fiction","Random House, Inc.",2010
2568,Digital,OverDrive,EBOOK,2018,1,2,"The Tropical Vegan Kitchen: Meat-Free, Egg-Free, Dairy-Free Dishes from the Tropics",,Donna Klein,"Cooking & Food, Nonfiction","Penguin Group (USA), Inc.",2009
2569,Digital,OverDrive,EBOOK,2018,1,2,The American Bird Conservancy Guide to the 500 Most Important Bird Areas in the United States: Key Sites for Birds and Birding in All 50 States,,American Bird Conservancy,"Nature, Nonfiction, Reference, Travel","Random House, Inc.",2011
2573,Digital,OverDrive,EBOOK,2018,1,1,Baked Explorations: Classic American Desserts Reinvented,,Matt Lewis,"Cooking & Food, Nonfiction",ABRAMS,2013
2580,Digital,OverDrive,EBOOK,2018,1,2,Forbidden Love,,Karen Robards,"Fiction, Historical Fiction, Literature, Romance","Simon & Schuster, Inc.",2014
2582,Digital,OverDrive,EBOOK,2018,1,2,The Fall of the Kings,,Ellen Kushner,"Fantasy, Fiction, Literature, Romance","Random House, Inc.",2016
2590,Digital,OverDrive,EBOOK,2018,1,4,All the Dirty Parts,,Daniel Handler,"Fiction, Literature",Bloomsbury USA,2017
2593,Digital,OverDrive,EBOOK,2018,1,1,"Night Watch: Watch Series, Book 1",,Sergei Lukyanenko,"Fiction, Science Fiction & Fantasy",Hyperion,2011
2595,Digital,OverDrive,EBOOK,2018,1,1,Fat Tuesday,,Sandra Brown,"Fiction, Suspense, Thriller","Hachette Digital, Inc.",2013
2596,Digital,OverDrive,EBOOK,2018,1,2,The Age of Innocence,,Edith Wharton,"Classic Literature, Fiction",Duke Classics,2018
2597,Digital,OverDrive,EBOOK,2018,1,3,One Flew Over the Cuckoo's Nest,,Ken Kesey,"Fiction, Literature","Penguin Group (USA), Inc.",2013
2598,Digital,OverDrive,EBOOK,2018,1,1,Bits & Pieces,,Judy Schachner,"Juvenile Fiction, Juvenile Literature, Picture Book Fiction","Penguin Group (USA), Inc.",2016
2600,Digital,OverDrive,EBOOK,2018,1,4,"Real: Real Series, Book 1",,Katy Evans,"Erotic Literature, Fiction, Romance","Simon & Schuster, Inc.",2014
2601,Digital,OverDrive,EBOOK,2018,1,1,Eaters of the Dead,,Michael Crichton,"Fiction, Historical Fiction, Suspense, Thriller","Random House, Inc.",2012
2606,Digital,OverDrive,EBOOK,2018,1,1,"Dear Miss Demeanor: Claire Malloy Mystery Series, Book 3",,Joan Hess,"Fiction, Mystery",Macmillan Publishers,2013
2608,Digital,OverDrive,EBOOK,2018,1,4,One Flew Over the Cuckoo's Nest,,Ken Kesey,"Classic Literature, Fiction","Penguin Group (USA), Inc.",2011
2610,Digital,OverDrive,EBOOK,2018,1,3,Dubliners: And Chamber Music,,James Joyce,"Classic Literature, Fiction, Short Stories",Duke Classics,2018
2611,Digital,OverDrive,EBOOK,2018,1,13,The Weight of Ink,,Rachel Kadish,"Fiction, Historical Fiction, Literature",Houghton Mifflin Harcourt Trade and Reference,2017
2618,Digital,OverDrive,EBOOK,2018,1,1,The House on Hope Street,,Danielle Steel,"Fiction, Romance","Random House, Inc.",2013
2625,Digital,OverDrive,EBOOK,2018,1,4,"Fire and Ice: Warriors Series, Book 2",,Erin Hunter,"Fantasy, Juvenile Fiction",HarperCollins Publishers Inc.,2010
2627,Digital,OverDrive,EBOOK,2018,1,3,"Magyk: Septimus Heap Series, Book 1",,Angie Sage,"Fantasy, Juvenile Fiction",HarperCollins Publishers Inc.,2008
2628,Digital,OverDrive,EBOOK,2018,1,1,The Unofficial LEGO Builder's Guide,,Allan Bedford,"Crafts, Juvenile Nonfiction","Random House, Inc.",2015
2642,Digital,OverDrive,EBOOK,2018,1,5,"False Colours: Regency Romances Series, Book 23",,Georgette Heyer,"Fiction, Historical Fiction, Romance",Sourcebooks,2008
2653,Digital,OverDrive,EBOOK,2018,1,1,The War for All the Oceans: From Nelson at the Nile to Napoleon at Waterloo,,Roy Adkins,"History, Military, Nonfiction","Penguin Group (USA), Inc.",2013
2655,Digital,OverDrive,EBOOK,2018,1,2,Johnstown Flood,,David McCullough,"Engineering, History, Nonfiction, Technology","Simon & Schuster, Inc.",2014
2666,Digital,OverDrive,EBOOK,2018,1,3,Orient: A Novel,,Christopher Bollen,"Fiction, Literature, Suspense, Thriller",HarperCollins Publishers Inc.,2015
2675,Digital,OverDrive,EBOOK,2018,1,3,"The Manhattan Project: The Birth of the Atomic Bomb in the Words of Its Creators, Eyewitnesses, and Historians",,Cynthia C. Kelly,"History, Military, Nonfiction","Hachette Digital, Inc.",2012
2676,Digital,OverDrive,EBOOK,2018,1,1,"Fire Me Up: Pine Mountain Series, Book 4",,Kimberly Kincaid,"Fiction, Literature, Romance","Random House, Inc.",2015
2683,Digital,OverDrive,EBOOK,2018,1,3,"Not a Creature Was Purring: Paws & Claws Mystery Series, Book 5",,Krista Davis,"Fiction, Literature, Mystery","Penguin Group (USA), Inc.",2017
2694,Digital,OverDrive,EBOOK,2018,1,1,"Night Night, Sleep Tight: A Novel of Suspense",,Hallie Ephron,"Fiction, Mystery, Suspense, Thriller",HarperCollins Publishers Inc.,2015
2698,Digital,OverDrive,EBOOK,2018,1,1,"Pouncing on Murder: Bookmobile Cat Mystery Series, Book 4",,Laurie Cass,"Fiction, Mystery","Penguin Group (USA), Inc.",2015
2699,Digital,OverDrive,EBOOK,2018,1,2,Belle de Jour: Diary of an Unlikely Call Girl,,Anonymous,"Biography & Autobiography, Nonfiction, Sociology","Hachette Digital, Inc.",2013
2701,Digital,OverDrive,EBOOK,2018,1,1,Lost and Found,,Jayne Ann Krentz,"Fiction, Romance, Suspense","Penguin Group (USA), Inc.",2013
2706,Digital,OverDrive,EBOOK,2018,1,1,Season of the Sandstorms,,Mary Pope Osborne,"Historical Fiction, Juvenile Fiction","Random House, Inc.",2009
2707,Digital,OverDrive,EBOOK,2018,1,1,An Illicit Temptation,,Jeannie Lin,"Fiction, Historical Fiction, Romance","Harlequin Enterprises, Ltd.",2015
2709,Digital,OverDrive,EBOOK,2018,1,1,Fast as the Flash! (DC Super Friends),,Christy Webster,"Comic and Graphic Books, Juvenile Fiction, Juvenile Literature","Random House, Inc.",2018
2715,Digital,OverDrive,EBOOK,2018,1,2,"Danger in the Darkest Hour: Magic Tree House: Super Edition Series, Book 1",,Mary Pope Osborne,"Historical Fiction, Juvenile Fiction","Random House, Inc.",2015
2726,Digital,OverDrive,EBOOK,2018,1,1,"The Old Deep and Dark: Jane Lawless Mystery, Book 22",,Ellen Hart,"Fiction, Literature, Mystery",Macmillan Publishers,2014
2727,Digital,OverDrive,EBOOK,2018,1,1,One Man's America: The Pleasures and Provocations of Our Singular Nation,,George Will,"History, Nonfiction, Politics, Sociology","Random House, Inc.",2008
2730,Digital,OverDrive,EBOOK,2018,1,1,Frommer's Italy 2013,,Donald Strachan,"Nonfiction, Travel","John Wiley & Sons, Inc.",2012
2733,Digital,OverDrive,EBOOK,2018,1,11,The Good Rain: Across Time and Terrain in the Pacific Northwest,,Timothy Egan,"Nature, Nonfiction","Random House, Inc.",2011
2734,Digital,OverDrive,EBOOK,2018,1,2,"Mightier Than the Sword: Clifton Chronicles, Book 5",,Jeffrey Archer,"Fiction, Suspense",Macmillan Publishers,2015
2738,Digital,OverDrive,EBOOK,2018,1,4,The Odyssey of Echo Company: The 1968 Tet Offensive and the Epic Battle to Survive the Vietnam War,,Doug Stanton,"History, Military, Nonfiction","Simon & Schuster, Inc.",2017
2742,Digital,OverDrive,EBOOK,2018,1,1,"Kenneth Clark: Life, Art and Civilisation",,James Stourton,"Art, Biography & Autobiography, History, Nonfiction","Random House, Inc.",2016
2743,Digital,OverDrive,EBOOK,2018,1,1,The Magician's Workbook: A Modern Grimoire,,Steve Savedow,"New Age, Nonfiction",Red Wheel Weiser Conari,2012
2749,Digital,OverDrive,EBOOK,2018,1,1,All Through the Night: A Suspense Story,,Mary Higgins Clark,"Fiction, Suspense","Simon & Schuster, Inc.",2014
2753,Digital,OverDrive,EBOOK,2018,1,1,"The Saint: Highland Guard Series, Book 6",,Monica McCarty,"Fiction, Historical Fiction, Romance","Random House, Inc.",2013
2754,Digital,OverDrive,EBOOK,2018,1,3,The Seattle Street-Smart Naturalist: Field Notes from the City,,David B. Williams,"Nature, Nonfiction",Lightning Source Inc,2017
2761,Digital,OverDrive,EBOOK,2018,1,4,Wrongful Death: A Novel,,Robert Dugoni,"Fiction, Literature, Suspense, Thriller","Simon & Schuster, Inc.",2014
2762,Digital,OverDrive,EBOOK,2018,1,2,"Stay Strong, Geronimo!: Geronimo Stilton Micekings Series, Book 4",,Geronimo Stilton,"Humor (Fiction), Juvenile Fiction, Juvenile Literature","Scholastic, Inc. (US)",2017
2767,Digital,OverDrive,EBOOK,2018,1,1,"If Looks Could Kill: Bailey Weggins Mystery Series, Book 1",,Kate White,"Fiction, Mystery","Hachette Digital, Inc.",2010
2771,Digital,OverDrive,EBOOK,2018,1,2,The Fourteenth Goldfish,,Jennifer L. Holm,"Juvenile Fiction, Juvenile Literature","Random House, Inc.",2014
2774,Digital,OverDrive,EBOOK,2018,1,1,You Too Can Have a Body Like Mine: A Novel,,Alexandra Kleeman,"Fiction, Literature",HarperCollins Publishers Inc.,2015
2780,Digital,OverDrive,EBOOK,2018,1,1,A Man for All Seasons,,Diana Palmer,"Fiction, Romance, Western","Harlequin Enterprises, Ltd.",2011
2799,Digital,OverDrive,EBOOK,2018,1,2,"The Cat, The Quilt and The Corpse: Cats in Trouble Mystery Series, Book 1",,Leann Sweeney,"Fiction, Mystery","Penguin Group (USA), Inc.",2011
2803,Digital,OverDrive,EBOOK,2018,1,1,"The Hostile Hospital: A Series of Unfortunate Events, Book 8",,Lemony Snicket,"Fantasy, Juvenile Fiction",HarperCollins Publishers Inc.,2007
2805,Digital,OverDrive,EBOOK,2018,1,1,Creativity,,Matthew Fox,"New Age, Nonfiction","Penguin Group (USA), Inc.",2009
2813,Digital,OverDrive,EBOOK,2018,1,1,"The Lies that Bind: Neil Hamel Series, Book 5",,Judith Van Gieson,"Fiction, Mystery","Blackstone Audio, Inc.",2013
2828,Digital,OverDrive,EBOOK,2018,1,1,"Sultry with a Twist: Sultry Springs Series, Book 1",,Macy Beckett,"Fiction, Romance",Sourcebooks,2012
2829,Digital,OverDrive,EBOOK,2018,1,2,After Hours,,Jodi L Copeland,"Erotic Literature, Fiction","Random House, Inc.",2006
2837,Digital,OverDrive,EBOOK,2018,1,5,With the Old Breed: At Peleliu and Okinawa,,E.B. Sledge,"Biography & Autobiography, History, Military, Nonfiction","Random House, Inc.",2013
2843,Digital,OverDrive,EBOOK,2018,1,2,"Ricky Ricotta's Mighty Robot vs. the Mecha-Monkeys from Mars: Ricky Ricotta Series, Book 4",,Dav Pilkey,"Juvenile Fiction, Juvenile Literature","Scholastic, Inc. (US)",2015
2850,Digital,OverDrive,EBOOK,2018,1,2,Good Hunting: A Spymaster's Story,,Jack Devine,"Biography & Autobiography, History, Nonfiction, Politics",Macmillan Publishers,2014
2852,Digital,OverDrive,EBOOK,2018,1,1,"The Accidental Highland Hero: Highlander Medieval Series, Book 2",,Terry Spear,"Fiction, Historical Fiction, Romance","Vinspire Publishing, LLC",2012
2862,Digital,OverDrive,EBOOK,2018,1,2,Raising Trump,,Ivana Trump,"Biography & Autobiography, Nonfiction","Simon & Schuster, Inc.",2017
2868,Digital,OverDrive,EBOOK,2018,1,1,"Bad Seeds: PI Jade de Jong Series, Book 5",,Jassy Mackenzie,"Fiction, Mystery","Random House, Inc.",2017
2885,Digital,OverDrive,EBOOK,2018,1,1,Watch Me: A Memoir,,Anjelica Huston,"Biography & Autobiography, Nonfiction","Simon & Schuster, Inc.",2014
2887,Digital,OverDrive,EBOOK,2018,1,4,"Northwest Gardener's Handbook: Your Complete Guide: Select, Plan, Plant, Maintain, Problem-Solve - Oregon, Washington, Northern California, British Columbia",,Pat Munts,"Gardening, Nonfiction",Quarto Publishing Group USA,2015
2890,Digital,OverDrive,EBOOK,2018,1,1,"The Last Little Blue Envelope: Little Blue Envelope Series, Book 2",,Maureen Johnson,Young Adult Fiction,HarperCollins Publishers Inc.,2011
2897,Digital,OverDrive,EBOOK,2018,1,8,Tortall: A Spy's Guide,,Tamora Pierce,"Fantasy, Young Adult Fiction, Young Adult Literature","Random House, Inc.",2017
2898,Digital,OverDrive,EBOOK,2018,1,1,Brokeback Mountain: Now a Major Motion Picture,,Annie Proulx,"Fiction, Literature","Simon & Schuster, Inc.",2014
2900,Digital,OverDrive,EBOOK,2018,1,1,No Book but the World: A Novel,,Leah Hager Cohen,"Fiction, Literature","Penguin Group (USA), Inc.",2014
2903,Digital,OverDrive,EBOOK,2018,1,10,"The Fate of the Tearling: Queen of the Tearling Series, Book 3",,Erika Johansen,"Fantasy, Fiction",HarperCollins Publishers Inc.,2016
2907,Digital,OverDrive,EBOOK,2018,1,2,Love is Blind,,Lynsay Sands,"Fiction, Romance",HarperCollins Publishers Inc.,2011
2908,Digital,OverDrive,EBOOK,2018,1,2,Augustown: A Novel,,Kei Miller,"Fiction, Literature","Random House, Inc.",2017
2920,Digital,OverDrive,EBOOK,2018,1,5,"Best Women's Erotica of the Year, Volume 2",,Rachel Kramer Bussel,"Erotic Literature, Fiction, Literary Anthologies","Simon & Schuster, Inc.",2017
2924,Digital,OverDrive,EBOOK,2018,1,3,Sober Stick Figure: A Memoir,,Amber Tozer,"Biography & Autobiography, Nonfiction","Hachette Digital, Inc.",2016
2925,Digital,OverDrive,EBOOK,2018,1,7,A Mind at Play: How Claude Shannon Invented the Information Age,,Jimmy Soni,"Biography & Autobiography, Computer Technology, Nonfiction, Technology","Simon & Schuster, Inc.",2017
2926,Digital,OverDrive,EBOOK,2018,1,4,National Parks of America: Experience America's 59 National Parks,,Lonely Planet,"Nonfiction, Travel","Lonely Planet Pty, Ltd",2016
2928,Digital,OverDrive,EBOOK,2018,1,1,Tossing and Turning,,John Updike,"Fiction, Poetry","Random House, Inc.",2012
2933,Digital,OverDrive,EBOOK,2018,1,1,The Law of Forgiveness: Tap in to the Positive Power of Forgiveness--and Attract Good Things to Your Life,,Connie Domino,"Nonfiction, Self-Improvement","Penguin Group (USA), Inc.",2009
2939,Digital,OverDrive,EBOOK,2018,1,1,"How America Lost Its Secrets: Edward Snowden, the Man and the Theft",,Edward Jay Epstein,"Nonfiction, Politics, True Crime","Random House, Inc.",2017
2943,Digital,OverDrive,EBOOK,2018,1,4,"Rules of Attraction: The Governess Brides Series, Book 3",,Christina Dodd,"Fiction, Historical Fiction, Romance",HarperCollins Publishers Inc.,2005
2946,Digital,OverDrive,EBOOK,2018,1,3,Godblind,,Anna Stephens,"Fantasy, Fiction, Thriller",Lightning Source Inc,2017
2947,Digital,OverDrive,EBOOK,2018,1,1,The Magic of Reality: How We Know What's Really True,,Richard Dawkins,"Nonfiction, Science, Sociology","Simon & Schuster, Inc.",2014
2950,Digital,OverDrive,EBOOK,2018,1,1,"Risk It: Rule Breakers Series, Book 4",,Jennifer Chance,"Fiction, Romance","Random House, Inc.",2015
2958,Digital,OverDrive,EBOOK,2018,1,2,Brunetti's Venice: Walks with the City's Best-Loved Detective,,Toni Sepeda,"Nonfiction, Travel",Lightning Source Inc,2014
2961,Digital,OverDrive,EBOOK,2018,1,1,The Org: The Underlying Logic of the Office,,Ray Fisman,"Business, Nonfiction, Psychology","Hachette Digital, Inc.",2013
2967,Digital,OverDrive,EBOOK,2018,1,2,"Detection Unlimited: Country House Mysteries Series, Book 12",,Georgette Heyer,"Fiction, Mystery",Sourcebooks,2011
2977,Digital,OverDrive,EBOOK,2018,1,1,Grimm's Last Fairytale: A Novel,,Haydn Middleton,"Fiction, Historical Fiction",Macmillan Publishers,2014
2991,Digital,OverDrive,EBOOK,2018,1,1,"The Navigator: Lorien Legacies: The Lost Files Series, Book 11",,Pittacus Lore,"Science Fiction, Short Stories, Young Adult Fiction",HarperCollins Publishers Inc.,2015
2995,Digital,OverDrive,EBOOK,2018,1,2,"The Retribution of Mara Dyer: Mara Dyer Series, Book 3",,Michelle Hodkin,"Mystery, Young Adult Fiction","Simon & Schuster, Inc.",2014
3001,Digital,OverDrive,EBOOK,2018,1,28,The Tipping Point: How Little Things Can Make a Big Difference,,Malcolm Gladwell,"Business, Nonfiction","Hachette Digital, Inc.",2007
3006,Digital,OverDrive,EBOOK,2018,1,1,"Carpe Corpus: The Morganville Vampires Series, Book 6",,Rachel Caine,"Fantasy, Horror, Young Adult Fiction","Penguin Group (USA), Inc.",2010
3007,Digital,OverDrive,EBOOK,2018,1,1,Nineteenth-Century American Poetry,,Various,"Fiction, Poetry","Penguin Group (USA), Inc.",2011
3018,Digital,OverDrive,EBOOK,2018,1,2,Seven Years to Sin,,Sylvia Day,,Kensington Publishing Corp.,2011
3019,Digital,OverDrive,EBOOK,2018,1,3,"A Cold Treachery: Inspector Ian Rutledge Mystery Series, Book 7",,Charles Todd,"Fiction, Mystery","Random House, Inc.",2010
3020,Digital,OverDrive,EBOOK,2018,1,3,"Blue Collar, White Collar, No Collar: Stories of Work",,Richard Ford,"Fiction, Short Stories",HarperCollins Publishers Inc.,2011
3025,Digital,OverDrive,EBOOK,2018,1,2,The Ballad of Gregoire Darcy: Jane Austen's Pride and Prejudice Continues,,Marsha Altman,"Fiction, Romance",Lightning Source Inc,2013
3026,Digital,OverDrive,EBOOK,2018,1,2,Wish You Were Here: A Novel,,Renée Carlino,"Fiction, Romance","Simon & Schuster, Inc.",2017
3027,Digital,OverDrive,EBOOK,2018,1,2,"Nightshifted: Edie Spence Series, Book 1",,Cassie Alexander,"Fantasy, Fiction, Romance",Macmillan Publishers,2013
3032,Digital,OverDrive,EBOOK,2018,1,1,Second Nature: A Gardener's Education,,Michael  Pollan,"Gardening, Nonfiction",Lightning Source Inc,2014
3038,Digital,OverDrive,EBOOK,2018,1,3,"The Snake, the Crocodile, and the Dog: Amelia Peabody Series, Book 7",,Elizabeth Peters,"Fiction, Historical Fiction, Mystery","Hachette Digital, Inc.",2012
3055,Digital,OverDrive,EBOOK,2018,1,1,Judy Moody es detective,,Megan McDonald,"Juvenile Fiction, Juvenile Literature, Non-English Fiction","Penguin Random House Grupo Editorial, S.A.U.",2017
3057,Digital,OverDrive,EBOOK,2018,1,1,"The Last Chapter: The Cartel Series, Book 3",,Ashley & JaQuavis,"African American Fiction, Fiction, Urban Fiction","Random House, Inc.",2011
3060,Digital,OverDrive,EBOOK,2018,1,1,Inspired & Unstoppable: Wildly Succeeding at Your Life's Work!,,Tama Kieves,"Business, Careers, Nonfiction","Penguin Group (USA), Inc.",2013
3062,Digital,OverDrive,EBOOK,2018,1,1,My Only Christmas Wish,,J.M.  Jeffries,"Fiction, Romance","Harlequin Enterprises, Ltd.",2012
3066,Digital,OverDrive,EBOOK,2018,1,1,"New York Dead: Stone Barrington Series, Book 1",,Stuart Woods,"Fiction, Mystery, Suspense",HarperCollins Publishers Inc.,2009
3067,Digital,OverDrive,EBOOK,2018,1,1,On Death and Dying,,Elisabeth Kübler-Ross,"Family & Relationships, Nonfiction, Psychology","Simon & Schuster, Inc.",2014
3069,Digital,OverDrive,EBOOK,2018,1,1,Vida,,Patricia Engel,"Fiction, Short Stories",Lightning Source Inc,2014
3070,Digital,OverDrive,EBOOK,2018,1,16,"The Ethical Slut: A Practical Guide to Polyamory, Open Relationships, and Other Freedoms in Sexand Love",,Janet W. Hardy,"Family & Relationships, Nonfiction, Philosophy, Self-Improvement","Random House, Inc.",2017
