,usageclass,checkouttype,materialtype,checkoutyear,checkoutmonth,checkouts,title,isbn,creator,subjects,publisher,publicationyear
7701,Digital,OverDrive,EBOOK,2018,1,1,"Betrothed: The Vampire Journals Series, Book 6",,Morgan Rice,"Fantasy, Romance, Young Adult Fiction",Kobo Writing Life,2016
7706,Digital,OverDrive,EBOOK,2018,1,2,The Marriage Pact,,Linda Lael Miller,"Fiction, Romance, Western","Harlequin Enterprises, Ltd.",2014
7708,Digital,OverDrive,EBOOK,2018,1,1,Angel of the Underground,,David Andreas,"Fiction, Horror, Romance, Thriller",Lightning Source Inc,2018
7712,Digital,OverDrive,EBOOK,2018,1,2,"Death Comes to the Fair: Kurland St. Mary Mystery Series, Book 4",,Catherine Lloyd,"Fiction, Historical Fiction, Mystery","Random House, Inc.",2016
7721,Digital,OverDrive,EBOOK,2018,1,3,Chaos: Making a New Science,,James Gleick,"Nonfiction, Science",Open Road Integrated Media,2011
7724,Digital,OverDrive,EBOOK,2018,1,1,"A Wedding for Christmas: Twilight, Texas Series, Book 7",,Lori Wilde,"Fiction, Romance",HarperCollins Publishers Inc.,2016
7726,Digital,OverDrive,EBOOK,2018,1,1,"Unsympathetic Magic: Esther Diamond Series, Book 3",,Laura Resnick,"Fantasy, Fiction","Penguin Group (USA), Inc.",2013
7729,Digital,OverDrive,EBOOK,2018,1,6,F*ck Love: One Shrink's Sensible Advice for Finding a Lasting Relationship,,"Michael Bennett, MD","Nonfiction, Psychology, Self-Improvement","Simon & Schuster, Inc.",2017
7730,Digital,OverDrive,EBOOK,2018,1,1,Upriver and Downstream: The Best Fly-Fishing and Angling Adventures from the New York Times,,New York Times,"Nonfiction, Sports & Recreations","Random House, Inc.",2010
7731,Digital,OverDrive,EBOOK,2018,1,8,The Sweet Life in Paris: Delicious Adventures in the World's Most Glorious--and Perplexing--City,,David Lebovitz,"Cooking & Food, Nonfiction, Travel","Random House, Inc.",2009
7733,Digital,OverDrive,EBOOK,2018,1,2,Camp So-and-So,,Mary McCoy,"Thriller, Young Adult Fiction",Lerner Publishing Group,2017
7734,Digital,OverDrive,EBOOK,2018,1,1,The Journals of Captain Cook,,James Cook,"Biography & Autobiography, Nonfiction","Penguin Group (USA), Inc.",2011
7735,Digital,OverDrive,EBOOK,2018,1,1,Bring the Outdoors In: 20 Garden Projects for the Decorating and Styling Interiors,,Shane Powers,"Home Design & Décor, Nonfiction",Chronicle Books,2013
7742,Digital,OverDrive,EBOOK,2018,1,2,The Brightest Star in the Sky,,Marian Keyes,"Fiction, Literature","Penguin Group (USA), Inc.",2010
7759,Digital,OverDrive,EBOOK,2018,1,1,"Stop That Frog!: Here's Hank Series, Book 3",,Henry Winkler,"Juvenile Fiction, Juvenile Literature","Penguin Group (USA), Inc.",2014
7767,Digital,OverDrive,EBOOK,2018,1,2,"A Path Appears: Transforming Lives, Creating Opportunity",,Nicholas D. Kristof,"Business, Education, Nonfiction, Sociology","Random House, Inc.",2014
7773,Digital,OverDrive,EBOOK,2018,1,1,"Bloodstar: Star Corpsman Series, Book 1",,Ian Douglas,"Fiction, Science Fiction",HarperCollins Publishers Inc.,2012
7774,Digital,OverDrive,EBOOK,2018,1,6,Backpacking Washington: Overnight and Multiday Routes,,Craig Romano,"Nonfiction, Sports & Recreations",Mountaineers Books,2015
7782,Digital,OverDrive,EBOOK,2018,1,2,Pegasus,,Robin McKinley,"Fantasy, Mythology, Young Adult Fiction, Young Adult Literature","Penguin Group (USA), Inc.",2011
7783,Digital,OverDrive,EBOOK,2018,1,5,"Dressed to Kilt: Scottish Highlands Mystery Series, Book 3",,Hannah Reed,"Fiction, Mystery","Penguin Group (USA), Inc.",2017
7784,Digital,OverDrive,EBOOK,2018,1,1,"All In: Naturals Series, Book 3",,Jennifer Lynn Barnes,"Mystery, Young Adult Fiction",Disney Digital Books,2016
7788,Digital,OverDrive,EBOOK,2018,1,2,"A Wild and Lonely Place: Sharon McCone Mystery Series, Book 15",,Marcia Muller,"Fiction, Mystery","Hachette Digital, Inc.",2010
7801,Digital,OverDrive,EBOOK,2018,1,1,Nine Horses: Poems,,Billy Collins,"Fiction, Poetry","Random House, Inc.",2011
7802,Digital,OverDrive,EBOOK,2018,1,4,Blackout: A Novel,,Marc Elsberg,"Fiction, Thriller",Sourcebooks,2017
7807,Digital,OverDrive,EBOOK,2018,1,1,The Secret of Happy Ever After,,Lucy Dillon,"Fiction, Literature","Penguin Group (USA), Inc.",2013
7812,Digital,OverDrive,EBOOK,2018,1,1,Vietnam: A History of the War,,Russell Freedman,"History, Young Adult Nonfiction",Holiday House,2016
7813,Digital,OverDrive,EBOOK,2018,1,5,"The Mitford Murders: Mitford Murders Series, Book 1",,Jessica Fellowes,"Fiction, Historical Fiction, Mystery",Macmillan Publishers,2018
7817,Digital,OverDrive,EBOOK,2018,1,3,"Art Lab for Kids: 52 Creative Adventures in Drawing, Painting, Printmaking, Paper, and Mixed Media-For Budding Artists",,Susan Schwake,"Art, Crafts, Nonfiction",Quarto Publishing Group USA,2012
7820,Digital,OverDrive,EBOOK,2018,1,3,"Ivy and Bean Make the Rules: Ivy and Bean Series, Book 9",,Annie Barrows,"Juvenile Fiction, Juvenile Literature",Chronicle Books,2012
7822,Digital,OverDrive,EBOOK,2018,1,2,Cat Chaser,,Elmore Leonard,"Fiction, Mystery",HarperCollins Publishers Inc.,2005
7828,Digital,OverDrive,EBOOK,2018,1,1,"The Slow Fix: Solve Problems, Work Smarter, and Live Better In a World Addicted to Speed",,Carl Honore,"Business, Nonfiction, Self-Improvement, Sociology",HarperCollins Publishers Inc.,2013
7831,Digital,OverDrive,EBOOK,2018,1,3,"The Food Lover's Guide to Paris: The Best Restaurants, Bistros, Cafés, Markets, Bakeries, and More",,Patricia Wells,"Cooking & Food, Nonfiction, Travel",Workman Publishing,2014
7834,Digital,OverDrive,EBOOK,2018,1,1,"The Interrogation of Ashala Wolf: Tribe Series, Book 1",,Ambelin Kwaymullina,"Science Fiction, Young Adult Fiction",Candlewick Press,2016
7839,Digital,OverDrive,EBOOK,2018,1,3,The Girl from the Metropol Hotel: Growing Up in Communist Russia,,Ludmilla Petrushevskaya,"Biography & Autobiography, History, Nonfiction","Penguin Group (USA), Inc.",2017
7842,Digital,OverDrive,EBOOK,2018,1,1,"H. M. S. Cockerel: Alan Lewrie Series, Book 6",,Dewey Lambdin,"Fiction, Historical Fiction, Suspense",Independent Publishers Group,2015
7849,Digital,OverDrive,EBOOK,2018,1,3,"The Empress File: Kidd and LuEllen Series, Book 2",,John Sandford,"Fiction, Thriller","Penguin Group (USA), Inc.",2013
7852,Digital,OverDrive,EBOOK,2018,1,1,Desecration,,Tim LaHaye,"Fiction, Suspense",Tyndale House Publishers,2011
7853,Digital,OverDrive,EBOOK,2018,1,1,The Ordinary Seaman,,Francisco Goldman,"Fiction, Literature",Lightning Source Inc,2014
7856,Digital,OverDrive,EBOOK,2018,1,3,When the English Fall: A Novel,,David Williams,"Fantasy, Fiction, Science Fiction",Workman Publishing,2017
7859,Digital,OverDrive,EBOOK,2018,1,1,"The Devil's Domain: Sorrowful Mysteries of Brother Athelstan Series, Book 8",,Paul Doherty,"Fiction, Historical Fiction, Mystery",Severn House Publishers Ltd,2013
7861,Digital,OverDrive,EBOOK,2018,1,3,"The Remaining--Allegiance: The Remaining Series, Book 5",,D. J. Molles,"Fiction, Science Fiction","Hachette Digital, Inc.",2015
7862,Digital,OverDrive,EBOOK,2018,1,2,"A Dangerous Love: Border Chronicles, Book 1",,Bertrice Small,"Fiction, Romance","Penguin Group (USA), Inc.",2013
7864,Digital,OverDrive,EBOOK,2018,1,2,"Pacific Fire: California Bones Series, Book 2",,Greg Van Eekhout,"Fantasy, Fiction",Macmillan Publishers,2015
7865,Digital,OverDrive,EBOOK,2018,1,2,"The Tehran Initiative: David Shirazi Series, Book 2",,Joel C. Rosenberg,"Christian Fiction, Fiction, Suspense, Thriller",Tyndale House Publishers,2011
7868,Digital,OverDrive,EBOOK,2018,1,4,"Beastly Bones: Jackaby Series, Book 2",,William  Ritter,"Fantasy, Historical Fiction, Young Adult Fiction",Workman Publishing,2015
7873,Digital,OverDrive,EBOOK,2018,1,4,Company Man: Thirty Years of Controversy and Crisis in the CIA,,John Rizzo,"Biography & Autobiography, History, Military, Nonfiction","Simon & Schuster, Inc.",2014
7877,Digital,OverDrive,EBOOK,2018,1,1,The Sky Fisherman,,Craig Lesley,"Fiction, Literature",Houghton Mifflin Harcourt Trade and Reference,2012
7881,Digital,OverDrive,EBOOK,2018,1,2,"Murder in the Museum, A British Library Crime Classic: Inspector Shelley Series, Book 6",,John Rowland,"Fiction, Historical Fiction, Mystery",Poisoned Pen Press,2016
7884,Digital,OverDrive,EBOOK,2018,1,3,Manufacturing Consent: The Political Economy of the Mass Media,,Edward S. Herman,"Media Studies, Nonfiction, Politics, Sociology","Random House, Inc.",2017
7888,Digital,OverDrive,EBOOK,2018,1,8,Moriarty: A Novel,,Anthony Horowitz,"Fiction, Historical Fiction, Literature, Mystery",HarperCollins Publishers Inc.,2014
7896,Digital,OverDrive,EBOOK,2018,1,1,Heat Wave: The Life and Career of Ethel Waters,,Donald Bogle,"Biography & Autobiography, Nonfiction",HarperCollins Publishers Inc.,2011
7907,Digital,OverDrive,EBOOK,2018,1,1,"Mission Titanic: The 39 Clues: Doublecross Series, Book 1",,Jude Watson,"Juvenile Fiction, Mystery, Suspense","Scholastic, Inc. (US)",2015
7911,Digital,OverDrive,EBOOK,2018,1,1,The Twelve Caesars,,Suetonius,"Biography & Autobiography, Nonfiction","Penguin Group (USA), Inc.",2011
7912,Digital,OverDrive,EBOOK,2018,1,4,"Magic Lost, Trouble Found: Raine Benares Series, Book 1",,Lisa Shearin,"Fantasy, Fiction","Penguin Group (USA), Inc.",2013
7916,Digital,OverDrive,EBOOK,2018,1,2,"The Graphic Designer's Guide to Pricing, Estimating, and Budgeting",,Theo Stephen Williams,"Art, Nonfiction",Lightning Source Inc,2010
7922,Digital,OverDrive,EBOOK,2018,1,1,Total Freedom: The Essential Krishnamurti,,Jiddu Krishnamurti,"Nonfiction, Philosophy, Religion & Spirituality",HarperCollins Publishers Inc.,2010
7925,Digital,OverDrive,EBOOK,2018,1,1,"The Dark Army: Starblade Chronicles, Book 2",,Joseph Delaney,"Fantasy, Horror, Young Adult Fiction, Young Adult Literature",HarperCollins Publishers Inc.,2016
7932,Digital,OverDrive,EBOOK,2018,1,6,Consider the Lobster: And Other Essays,,David Foster Wallace,"Literary Criticism, Nonfiction","Hachette Digital, Inc.",2009
7935,Digital,OverDrive,EBOOK,2018,1,1,"In the Shadow of Denali: Heart of Alaska Series, Book 1",,Tracie Peterson,"Fiction, Historical Fiction, Romance",Baker Publishing Group,2017
7936,Digital,OverDrive,EBOOK,2018,1,3,Undetected,,Dee Henderson,"Fiction, Romance, Suspense",Baker Publishing Group,2014
7937,Digital,OverDrive,EBOOK,2018,1,4,"Clouds of Witness: Lord Peter Wimsey Series, Book 2",,Dorothy L. Sayers,"Fiction, Mystery",Open Road Integrated Media,2012
7940,Digital,OverDrive,EBOOK,2018,1,1,One Big Thing: Discovering What You Were Born to Do,,Phil Howard Cooke,"Business, Nonfiction",Thomas Nelson Inc.,2013
7941,Digital,OverDrive,EBOOK,2018,1,2,When Food Is Love: Exploring the Relationship Between Eating and Intimacy,,Geneen Roth,"Family & Relationships, Nonfiction, Psychology, Self-Improvement","Penguin Group (USA), Inc.",2009
7948,Digital,OverDrive,EBOOK,2018,1,2,"In Bed with the Duke: The Governess Brides Series, Book 8",,Christina Dodd,"Fiction, Historical Fiction, Romance","Penguin Group (USA), Inc.",2013
7949,Digital,OverDrive,EBOOK,2018,1,4,Energy Myths and Realities: Bringing Science to the Energy Policy Debate,,Vaclav Smil,"Nonfiction, Science",Rowman and Littlefield Publishing Group,2011
7963,Digital,OverDrive,EBOOK,2018,1,3,Double Sin and Other Stories,,Agatha Christie,"Fiction, Mystery",HarperCollins Publishers Inc.,2013
7966,Digital,OverDrive,EBOOK,2018,1,1,Alfie: (The Turtle That Disappeared),,Thyra Heder,"Juvenile Fiction, Juvenile Literature, Picture Book Fiction",ABRAMS,2017
7988,Digital,OverDrive,EBOOK,2018,1,3,The Ladies of Grace Adieu and Other Stories,,Susanna Clarke,"Fiction, Literature",Bloomsbury USA,2013
7996,Digital,OverDrive,EBOOK,2018,1,1,"Tell Me, Pretty Maiden: Molly Murphy Series, Book 7",,Rhys Bowen,"Fiction, Historical Fiction, Mystery",Macmillan Publishers,2013
7998,Digital,OverDrive,EBOOK,2018,1,1,Stripped,,Jasinda Wilder,"Erotic Literature, Fiction, Romance",NLA Digital LLC,2015
8002,Digital,OverDrive,EBOOK,2018,1,1,"Beyond the Edge of the Sea: Sailing with Jason and the Argonauts, Ulysses, the Vikings, and Other Explorersof the Ancient World",,Mauricio Obregon,"History, Literary Criticism, Nonfiction","Random House, Inc.",2010
8004,Digital,OverDrive,EBOOK,2018,1,1,In the Heart of the Canyon,,Elisabeth Hyde,"Fiction, Literature, Suspense, Thriller","Random House, Inc.",2009
8005,Digital,OverDrive,EBOOK,2018,1,3,Alien Tryst,,Cynthia Sax,"Erotic Literature, Fiction, Romance",Ellora's Cave Publishing Inc,2015
8007,Digital,OverDrive,EBOOK,2018,1,1,Awake at Work: 35 Practical Buddhist Principles for Discovering Clarity and Balance in the Midst of Work's Chaos,,Michael Carroll,"New Age, Nonfiction, Religion & Spirituality","Random House, Inc.",2011
8013,Digital,OverDrive,EBOOK,2018,1,2,Creating a Life Worth Living,,Carol Lloyd,"Nonfiction, Self-Improvement",HarperCollins Publishers Inc.,2012
8026,Digital,OverDrive,EBOOK,2018,1,4,Quarry's Climax,,Max Allan Collins,"Fiction, Mystery","Random House, Inc.",2017
8027,Digital,OverDrive,EBOOK,2018,1,1,The Flight of the Falcon,,Daphne du Maurier,"Fiction, Mystery, Suspense, Thriller","Hachette Digital, Inc.",2014
8029,Digital,OverDrive,EBOOK,2018,1,1,Ty Cobb: A Terrible Beauty,,Charles Leerhsen,"Biography & Autobiography, Nonfiction, Sports & Recreations","Simon & Schuster, Inc.",2015
8037,Digital,OverDrive,EBOOK,2018,1,2,"Good Dukes Wear Black: The Lords of Anarchy Series, Book 3",,Manda Collins,"Fiction, Historical Fiction, Romance",Macmillan Publishers,2016
8038,Digital,OverDrive,EBOOK,2018,1,2,Before the Snow,,Danielle Paige,"Fantasy, Romance, Young Adult Fiction",Bloomsbury USA,2016
8048,Digital,OverDrive,EBOOK,2018,1,1,Conjured,,Sarah Beth Durst,"Mystery, Young Adult Fiction",Bloomsbury USA,2013
8049,Digital,OverDrive,EBOOK,2018,1,4,"What to Do with a Bad Boy: The McCauley Brothers Series, Book 4",,Marie Harte,"Fiction, Romance",Sourcebooks,2015
8055,Digital,OverDrive,EBOOK,2018,1,3,Stakeout at the Vampire Circus,,Kevin J. Anderson,"Fantasy, Fiction","Random House, Inc.",2014
8057,Digital,OverDrive,EBOOK,2018,1,2,Torn: A Billionaire Bachelors Club Novel,,Monica Murphy,"Fiction, Romance",HarperCollins Publishers Inc.,2017
8058,Digital,OverDrive,EBOOK,2018,1,1,The Diver's Clothes Lie Empty: A Novel,,Vendela Vida,"Fiction, Literature, Mystery, Thriller",HarperCollins Publishers Inc.,2015
8059,Digital,OverDrive,EBOOK,2018,1,1,The Samurai of Seville: A Novel,,John Healey,"Fiction, Historical Fiction, Literature",Lightning Source Inc,2017
8067,Digital,OverDrive,EBOOK,2018,1,4,"And Only to Deceive: Lady Emily Series, Book 1",,Tasha Alexander,"Fiction, Suspense",HarperCollins Publishers Inc.,2014
8068,Digital,OverDrive,EBOOK,2018,1,1,The Glass Cage: How Our Computers Are Changing Us,,Nicholas Carr,"Nonfiction, Science, Technology",W. W. Norton & Company,2015
8075,Digital,OverDrive,EBOOK,2018,1,3,Mind's Own Physician: A Scientific Dialogue with the Dalai Lama on the Healing Power of Meditation,,Jon Kabat-Zinn,"Health & Fitness, Nonfiction",New Harbinger Publications,2013
8076,Digital,OverDrive,EBOOK,2018,1,3,"Saving Mr. Terupt: Mr. Terupt Series, Book 3",,Rob Buyea,"Juvenile Fiction, Young Adult Literature","Random House, Inc.",2015
8078,Digital,OverDrive,EBOOK,2018,1,1,The Broken Rules of Ten: Tenzing Norbu's First Mystery,,Gay Hendricks,"Fiction, Literature","Hay House, Inc.",2015
8092,Digital,OverDrive,EBOOK,2018,1,1,Bride of a Scottish Warrior,,Adrienne Basso,"Fiction, Historical Fiction, Romance","Random House, Inc.",2014
8100,Digital,OverDrive,EBOOK,2018,1,2,War and Peace,,Leo Tolstoy,"Classic Literature, Fiction, Literature","Random House, Inc.",2012
8102,Digital,OverDrive,EBOOK,2018,1,2,On the Island: A Novel,,Tracey Garvis Graves,"Fiction, Romance","Penguin Group (USA), Inc.",2013
8103,Digital,OverDrive,EBOOK,2018,1,1,A Vineyard in My Glass,,Gerald Asher,"Cooking & Food, Nonfiction",University of California Press,2011
8112,Digital,OverDrive,EBOOK,2018,1,1,"The Cannabis Breeder's Bible: The Definitive Guide to Marijuana Genetics, Cannabis Botany and Creating Strains for the Seed Market",,Greg Green,"Gardening, Nonfiction, Sociology",Lightning Source Inc,2011
8116,Digital,OverDrive,EBOOK,2018,1,1,Spark: How Creativity Works,,Julie Burstein,"Nonfiction, Psychology",HarperCollins Publishers Inc.,2011
8122,Digital,OverDrive,EBOOK,2018,1,2,Sonia Sotomayor: A Judge Grows in the Bronx/La juez que creció en el Bronx,,Jonah Winter,"Biography & Autobiography, Careers, Juvenile Nonfiction, Non-English Nonfiction","Simon & Schuster, Inc.",2017
8130,Digital,OverDrive,EBOOK,2018,1,1,Crown of Stars: Book II of the Night Song Trilogy,,Sophie Jaff,"Fantasy, Fiction, Literature",HarperCollins Publishers Inc.,2017
8132,Digital,OverDrive,EBOOK,2018,1,7,Catch-22: 50th Anniversary Edition,,Joseph Heller,"Classic Literature, Fiction, Literature","Simon & Schuster, Inc.",2015
8136,Digital,OverDrive,EBOOK,2018,1,1,"Grandad, There's a Head on the Beach: Jimm Juree Series, Book 2",,Colin Cotterill,"Fiction, Mystery",Macmillan Publishers,2013
8140,Digital,OverDrive,EBOOK,2018,1,1,"Mischief by Moonlight: Regency Mischief Series, Book 3",,Emily Greenwood,"Fiction, Historical Fiction, Romance",Sourcebooks,2015
8145,Digital,OverDrive,EBOOK,2018,1,7,Dark Legacy,,Christine Feehan,"Fantasy, Fiction, Romance","Penguin Group (USA), Inc.",2017
8149,Digital,OverDrive,EBOOK,2018,1,1,"The Mark of the Vampire Queen: Vampire Queen Series, Book 2",,Joey W. Hill,"Erotic Literature, Fantasy, Fiction, Romance","Penguin Group (USA), Inc.",2013
8153,Digital,OverDrive,EBOOK,2018,1,6,I Believe in a Thing Called Love,,Maurene Goo,"Romance, Young Adult Fiction, Young Adult Literature",Macmillan Publishers,2017
8156,Digital,OverDrive,EBOOK,2018,1,2,"One-Pot Paleo: Simple to Make, Delicious to Eat and Gluten-free to Boot",,Jenny Castaneda,"Cooking & Food, Health & Fitness, Nonfiction",Macmillan Publishers,2015
8158,Digital,OverDrive,EBOOK,2018,1,2,"Penumbra: Spook Squad Series, Book 3",,Keri Arthur,"Fantasy, Fiction, Romance","Random House, Inc.",2015
8162,Digital,OverDrive,EBOOK,2018,1,2,Positively Pippa,,Sarah Hegger,"Fiction, Humor (Fiction), Literature, Romance","Random House, Inc.",2017
8166,Digital,OverDrive,EBOOK,2018,1,1,"Rose and the Lost Princess: Rose Series, Book 2",,Holly Webb,"Juvenile Fiction, Juvenile Literature",Sourcebooks,2014
8177,Digital,OverDrive,EBOOK,2018,1,1,The Valancourt Book of Victorian Christmas Ghost Stories,,Tara Moore,"Fiction, Horror, Literature, Short Stories",Valancourt Books,2017
8179,Digital,OverDrive,EBOOK,2018,1,5,Should the Tent Be Burning Like That?: A Professional Amateur's Guide to the Outdoors,,Bill Heavey,"Essays, Humor (Nonfiction), Nonfiction, Sports & Recreations",Lightning Source Inc,2017
8184,Digital,OverDrive,EBOOK,2018,1,2,The Hunt,,Megan Shepherd,"Science Fiction, Young Adult Fiction, Young Adult Literature",HarperCollins Publishers Inc.,2016
8185,Digital,OverDrive,EBOOK,2018,1,1,Battlemage,,Stephen Aryan,"Fantasy, Fiction, Historical Fiction, Thriller","Hachette Digital, Inc.",2016
8187,Digital,OverDrive,EBOOK,2018,1,3,Bloodchild and Other Stories,,Octavia E. Butler,"Fiction, Literature, Science Fiction, Short Stories","Random House, Inc.",2012
8192,Digital,OverDrive,EBOOK,2018,1,5,The Boston Girl: A Novel,,Anita Diamant,"Fiction, Historical Fiction, Literature","Simon & Schuster, Inc.",2014
8195,Digital,OverDrive,EBOOK,2018,1,1,The Cove,,Ron Rash,"Fiction, Literature",HarperCollins Publishers Inc.,2012
8198,Digital,OverDrive,EBOOK,2018,1,1,"Outboard Engines: Maintenance, Troubleshooting, and Repair",,Edwin R. Sherman,"Nonfiction, Sports & Recreations",McGraw-Hill Professional,2008
8201,Digital,OverDrive,EBOOK,2018,1,2,"Bold: How to Go Big, Achieve Success and Impact the World",,Peter H. Diamandis,"Business, Nonfiction, Sociology, Technology","Simon & Schuster, Inc.",2015
8202,Digital,OverDrive,EBOOK,2018,1,2,Annals of the Former World,,John McPhee,"Nonfiction, Science",Macmillan Publishers,2013
8207,Digital,OverDrive,EBOOK,2018,1,1,The Geek Feminist Revolution,,Kameron Hurley,"Literary Criticism, Nonfiction, Sociology",Macmillan Publishers,2016
8208,Digital,OverDrive,EBOOK,2018,1,1,Winter's Tide,,Lisa Williams Kline,Juvenile Fiction,Zondervan,2013
8210,Digital,OverDrive,EBOOK,2018,1,1,"The Pericles Commission: Athenian Mystery Series, Book 1",,Gary Corby,"Fiction, Historical Fiction, Mystery",Macmillan Publishers,2013
8211,Digital,OverDrive,EBOOK,2018,1,2,"The Phantom Bully: Star Wars: Jedi Academy Series, Book 3",,Jeffrey Brown,"Comic and Graphic Books, Juvenile Fiction, Science Fiction","Scholastic, Inc. (US)",2015
8213,Digital,OverDrive,EBOOK,2018,1,3,"The Winning Hand: MacGregor Series, Book 9",,Nora Roberts,"Fiction, Romance","Penguin Group (USA), Inc.",2013
8219,Digital,OverDrive,EBOOK,2018,1,2,"Redemption of the Duke: Brides of Redemption Series, Book 3",,Gayle Callen,"Fiction, Historical Fiction, Romance",HarperCollins Publishers Inc.,2014
8223,Digital,OverDrive,EBOOK,2018,1,2,The Yosemite,,John Muir,"Biography & Autobiography, Nature, Nonfiction, Reference","Random House, Inc.",2010
8229,Digital,OverDrive,EBOOK,2018,1,2,"The Persian Boy: Alexander the Great Series, Book 2",,Mary Renault,"Fiction, Historical Fiction",Open Road Integrated Media,2015
8242,Digital,OverDrive,EBOOK,2018,1,1,The Rough Guide to New Zealand,,Laura Harper,"Nonfiction, Travel",DK Publishing & Rough Guides,2011
8243,Digital,OverDrive,EBOOK,2018,1,1,Esther the Wonder Pig: Changing the World One Heart at a Time,,Steve Jenkins,"Biography & Autobiography, Nonfiction, Pets, Sociology","Hachette Digital, Inc.",2016
8245,Digital,OverDrive,EBOOK,2018,1,2,"Mrs. Jeffries Holds the Trump: Mrs. Jeffries and Inspector Witherspoon Series, Book 24",,Emily Brightwell,"Fiction, Mystery","Penguin Group (USA), Inc.",2012
8256,Digital,OverDrive,EBOOK,2018,1,8,"The Longevity Diet: Discover the New Science Behind Stem Cell Activation and Regeneration to SlowAging, Fight Disease, and Optimize Weight",,Valter Longo,"Health & Fitness, Nonfiction, Science","Penguin Group (USA), Inc.",2018
8260,Digital,OverDrive,EBOOK,2018,1,2,"Deadzone: Horizon Series, Book 2",,Jennifer A. Nielsen,"Juvenile Fiction, Juvenile Literature, Science Fiction","Scholastic, Inc. (US)",2017
8261,Digital,OverDrive,EBOOK,2018,1,1,"The Screenwriter's Problem Solver: How to Recognize, Identify, and Define Screenwriting Problems",,Syd Field,"Nonfiction, Performing Arts, Reference","Random House, Inc.",2009
8265,Digital,OverDrive,EBOOK,2018,1,1,Love on Tap,,Karis Walsh,"Fiction, Literature","Bold Strokes Books, Inc.",2016
8269,Digital,OverDrive,EBOOK,2018,1,1,A Simple Plan,,Scott Smith,"Fiction, Literature, Suspense, Thriller","Random House, Inc.",2010
8272,Digital,OverDrive,EBOOK,2018,1,5,"Death of a Hussy: Hamish Macbeth Mystery Series, Book 5",,M. C. Beaton,"Fiction, Mystery","Hachette Digital, Inc.",2013
8290,Digital,OverDrive,EBOOK,2018,1,2,"Of Books and Bagpipes: Scottish Bookshop Mystery Series, Book 2",,Paige Shelton,"Fiction, Mystery",Macmillan Publishers,2017
8294,Digital,OverDrive,EBOOK,2018,1,5,"Ash and Quill: The Great Library Series, Book 3",,Rachel Caine,"Fantasy, Science Fiction & Fantasy, Young Adult Fiction, Young Adult Literature","Penguin Group (USA), Inc.",2017
8301,Digital,OverDrive,EBOOK,2018,1,1,The Garden District of New Orleans,,Jim Fraiser,"History, Nonfiction",University Press of Mississippi,2013
8302,Digital,OverDrive,EBOOK,2018,1,1,Night Light,,Terri Blackstock,"Fiction, Science Fiction, Suspense, Thriller",Zondervan,2013
8303,Digital,OverDrive,EBOOK,2018,1,1,The Science of Interstellar,,Kip Thorne,"Nonfiction, Performing Arts, Science",W. W. Norton & Company,2015
8305,Digital,OverDrive,EBOOK,2018,1,1,Best Served Wild: Real Food for Real Adventures,,Brendan Leonard,"Cooking & Food, Nonfiction",Rowman and Littlefield Publishing Group,2017
8306,Digital,OverDrive,EBOOK,2018,1,25,The Heart's Invisible Furies: A Novel,,John Boyne,"Fiction, Literature","Random House, Inc.",2017
8310,Digital,OverDrive,EBOOK,2018,1,3,Think of England,,KJ Charles,"Fiction, Historical Fiction, Literature, Romance","Samhain Publishing, Ltd.",2015
8314,Digital,OverDrive,EBOOK,2018,1,3,"By Her Touch: Blank Canvas Series, Book 2",,Adriana Anders,"Fiction, Romance",Sourcebooks,2017
8319,Digital,OverDrive,EBOOK,2018,1,2,Lords of Passion,,Virginia Henley,"Fiction, Historical Fiction, Romance",Kensington Publishing Corp.,2010
8321,Digital,OverDrive,EBOOK,2018,1,2,"I Married the Duke: Prince Catchers Series, Book 1",,Katharine Ashe,"Fiction, Historical Fiction, Romance",HarperCollins Publishers Inc.,2013
8325,Digital,OverDrive,EBOOK,2018,1,7,"The Caldera: The Brotherband Chronicles Series, Book 7",,John Flanagan,"Juvenile Fiction, Juvenile Literature, Mythology","Penguin Group (USA), Inc.",2017
8329,Digital,OverDrive,EBOOK,2018,1,1,"Nightwalker: Dark Days Series, Book 1",,Jocelynn Drake,"Fantasy, Fiction",HarperCollins Publishers Inc.,2012
8344,Digital,OverDrive,EBOOK,2018,1,16,Man's Search for Meaning,,Viktor E. Frankl,"History, Nonfiction, Psychology, Religion & Spirituality","Random House, Inc.",2012
8346,Digital,OverDrive,EBOOK,2018,1,1,The Book of Gold,,Bob Staake,"Juvenile Fiction, Juvenile Literature, Picture Book Fiction","Random House, Inc.",2017
8352,Digital,OverDrive,EBOOK,2018,1,7,Splintered Silence,,Susan Furlong,"Fiction, Mystery","Random House, Inc.",2018
8356,Digital,OverDrive,EBOOK,2018,1,2,The Creative Life: True Tales of Inspiration,,Julia Cameron,"Nonfiction, Self-Improvement","Penguin Group (USA), Inc.",2010
8358,Digital,OverDrive,EBOOK,2018,1,1,"Moon Burning: Children of the Moon Series, Book 3",,Lucy Monroe,"Fantasy, Fiction, Romance","Penguin Group (USA), Inc.",2013
8359,Digital,OverDrive,EBOOK,2018,1,4,"Paths & Portals: Secret Coders Series, Book 2",,Gene Luen Yang,"Comic and Graphic Books, Juvenile Fiction",Macmillan Publishers,2016
8367,Digital,OverDrive,EBOOK,2018,1,4,Ask & It Is Given,,Esther Hicks,"New Age, Nonfiction","Hay House, Inc.",2014
8375,Digital,OverDrive,EBOOK,2018,1,5,Frontier,,Can Xue,"Fiction, Literature",Lightning Source Inc,2017
