,usageclass,checkouttype,materialtype,checkoutyear,checkoutmonth,checkouts,title,isbn,creator,subjects,publisher,publicationyear
0,Digital,OverDrive,EBOOK,2018,1,22,Enemy of the State,,Vince Flynn,"Fiction, Literature, Thriller","Simon & Schuster, Inc.",2017
3,Digital,OverDrive,EBOOK,2018,1,2,Anna Karenina,,Leo Tolstoy,"Classic Literature, Fiction, Literature","Penguin Group (USA), Inc.",2009
4,Digital,OverDrive,EBOOK,2018,1,1,"Dragon: Vlad Series, Book 8",,Steven Brust,"Fantasy, Fiction",Macmillan Publishers,2015
5,Digital,OverDrive,EBOOK,2018,1,1,Little Dorrit,,Charles Dickens,"Classic Literature, Fiction, Literature","Random House, Inc.",2012
6,Digital,OverDrive,EBOOK,2018,1,2,The Inside Out Man,,Fred Strydom,"Fiction, Horror, Suspense, Thriller",Lightning Source Inc,2017
8,Digital,OverDrive,EBOOK,2018,2,1,Krik? Krak!,,Edwidge Danticat,"Fiction, Literature, Short Stories","Random House, Inc.",2013
11,Digital,OverDrive,EBOOK,2018,2,4,Starlings,,Jo Walton,"Fantasy, Fiction, Mythology, Short Stories",Lightning Source Inc,2018
17,Digital,OverDrive,EBOOK,2018,2,1,A Death in Valencia,,Jason Webster,"Fiction, Mystery",Macmillan Publishers,2016
24,Digital,OverDrive,EBOOK,2018,3,1,Wayne of Gotham,,Tracy Hickman,"Fiction, Literature",HarperCollins Publishers Inc.,2012
26,Digital,OverDrive,EBOOK,2018,3,5,I'd Know You Anywhere: A Novel,,Laura Lippman,"Fiction, Mystery",HarperCollins Publishers Inc.,2010
28,Digital,OverDrive,EBOOK,2018,3,2,The Deep End of the Ocean,,Jacquelyn Mitchard,"Fiction, Literature","Penguin Group (USA), Inc.",2009
31,Digital,OverDrive,EBOOK,2018,3,2,The Mysterious Mr. Quin,,Agatha Christie,"Fiction, Mystery",HarperCollins Publishers Inc.,2010
32,Digital,OverDrive,EBOOK,2018,3,1,Secondhand Charm,,Julie Berry,"Fantasy, Young Adult Fiction",Bloomsbury USA,2010
33,Digital,OverDrive,EBOOK,2018,3,3,Apex: Nexus Trilogy Book 3,,Ramez Naam,"Fiction, Science Fiction, Thriller","Random House, Inc.",2016
37,Digital,OverDrive,EBOOK,2018,3,2,More Than This,,Patrick Ness,"Young Adult Fiction, Young Adult Literature",Candlewick Press,2013
40,Digital,OverDrive,EBOOK,2018,5,3,How to Listen to Jazz,,Ted Gioia,"History, Music, Nonfiction","Hachette Digital, Inc.",2016
41,Digital,OverDrive,EBOOK,2018,5,2,"Love, Chloe",,Alessandra Torre,"Fiction, Humor (Fiction), Romance",Lightning Source Inc,2016
44,Digital,OverDrive,EBOOK,2018,8,2,In Arabian Nights,,Tahir Shah,"Nonfiction, Travel","Random House, Inc.",2010
47,Digital,OverDrive,EBOOK,2018,10,4,Invitation to a Bonfire,,Adrienne Celt,"Fiction, Literature",Bloomsbury USA,2018
48,Digital,OverDrive,EBOOK,2018,11,18,And Then There Were None,,Agatha Christie,"Fiction, Mystery",HarperCollins Publishers Inc.,2006
50,Digital,OverDrive,EBOOK,2018,12,3,Love Is Murder,,Sandra Brown,"Fiction, Thriller, Thriller","Harlequin Enterprises, Ltd.",2013
51,Digital,OverDrive,EBOOK,2018,12,3,Monkey Play,,Alyssa Satin Capucilli,"Beginning Reader, Juvenile Fiction","Random House, Inc.",2013
52,Digital,OverDrive,EBOOK,2018,12,1,The History of Cuba,,Clifford L. Staten,"History, Nonfiction",ABC-CLIO,2010
53,Digital,OverDrive,EBOOK,2018,12,2,First Date,,Krista McGee,"Christian Fiction, Romance, Young Adult Fiction",Thomas Nelson Inc.,2012
56,Digital,OverDrive,EBOOK,2018,12,1,The Story of French,,Jean-Benoit Nadeau,"History, Language Arts, Nonfiction",Macmillan Publishers,2013
61,Digital,OverDrive,EBOOK,2018,12,1,Who Was Ben Franklin?,,Dennis Brindell Fradin,"Biography & Autobiography, Juvenile Nonfiction","Penguin Group (USA), Inc.",2013
64,Digital,OverDrive,EBOOK,2018,12,2,"A Christmas Secret: Christmas Story Series, Book 4",,Anne Perry,"Fiction, Historical Fiction, Mystery","Random House, Inc.",2010
67,Digital,OverDrive,EBOOK,2018,12,6,In Other Lands,,Sarah Rees Brennan,"Fantasy, Folklore, Young Adult Fiction",Lightning Source Inc,2017
69,Digital,OverDrive,EBOOK,2018,12,1,"The Favored Child: Wideacre Trilogy, Book 2",,Philippa Gregory,"Fiction, Historical Fiction","Simon & Schuster, Inc.",2014
75,Digital,OverDrive,EBOOK,2018,12,2,The Girls' Guide to Hunting and Fishing,,Melissa Bank,"Fiction, Literature","Penguin Group (USA), Inc.",2013
113,Digital,OverDrive,EBOOK,2018,1,2,Smut,,Karina Halle,"Fiction, Romance","Smashwords, Inc.",2016
140,Digital,OverDrive,EBOOK,2018,1,2,Playing Dirty,,Susan Andersen,"Fiction, Romance","Harlequin Enterprises, Ltd.",2012
142,Digital,OverDrive,EBOOK,2018,1,1,Hunted,,Karen Robards,"Fiction, Romance, Suspense","Simon & Schuster, Inc.",2014
145,Digital,OverDrive,EBOOK,2018,1,1,Chomsky on Anarchism,,Noam Chomsky,"Essays, Nonfiction, Politics",Perseus Books Group,2010
146,Digital,OverDrive,EBOOK,2018,1,2,Timon of Athens,,William Shakespeare,"Drama, Fiction","Penguin Group (USA), Inc.",2011
147,Digital,OverDrive,EBOOK,2018,1,1,The White Plague,,Frank Herbert,"Fiction, Science Fiction",Macmillan Publishers,2013
148,Digital,OverDrive,EBOOK,2018,1,2,Momofuku Milk Bar,,Christina Tosi,"Cooking & Food, Nonfiction","Random House, Inc.",2011
150,Digital,OverDrive,EBOOK,2018,1,4,Joy in the Morning,,P. G. Wodehouse,"Fiction, Humor (Fiction)",W. W. Norton & Company,2015
152,Digital,OverDrive,EBOOK,2018,1,4,Ordinary Beast,,Nicole Sealey,"Fiction, Poetry",HarperCollins Publishers Inc.,2017
153,Digital,OverDrive,EBOOK,2018,1,13,Heroes of the Frontier,,Dave Eggers,"Fiction, Literature, Thriller","Random House, Inc.",2016
159,Digital,OverDrive,EBOOK,2018,1,1,The Bishop's Daughter,,Tiffany L. Warren,"Fiction, Literature","Hachette Digital, Inc.",2012
166,Digital,OverDrive,EBOOK,2018,1,1,Seating Arrangements,,Maggie Shipstead,"Fiction, Literature","Random House, Inc.",2012
168,Digital,OverDrive,EBOOK,2018,1,7,2BR02B,,Kurt Vonnegut,"Fiction, Science Fiction, Short Stories",Duke Classics,2018
169,Digital,OverDrive,EBOOK,2018,1,27,The Road,,Cormac McCarthy,"Fiction, Literature","Random House, Inc.",2008
172,Digital,OverDrive,EBOOK,2018,1,3,Warrior of the Light,,Paulo Coelho,Fiction,HarperCollins Publishers Inc.,2006
180,Digital,OverDrive,EBOOK,2018,1,2,Schindler's List,,Thomas Keneally,"Fiction, Historical Fiction","Simon & Schuster, Inc.",2014
181,Digital,OverDrive,EBOOK,2018,1,1,The Body Where I Was Born,,Guadalupe Nettel,"Fiction, Literature","Random House, Inc.",2015
182,Digital,OverDrive,EBOOK,2018,1,1,HHhH: A Novel,,Laurent Binet,"Fiction, Literature",Macmillan Publishers,2013
184,Digital,OverDrive,EBOOK,2018,1,1,Losing It,,Cora Carmack,"Fiction, Romance",HarperCollins Publishers Inc.,2013
185,Digital,OverDrive,EBOOK,2018,1,4,Freaky Deaky,,Elmore Leonard,Fiction,HarperCollins Publishers Inc.,2005
189,Digital,OverDrive,EBOOK,2018,1,3,The Toyota Way Fieldbook,,Jeffrey K. Liker,"Business, Nonfiction",McGraw-Hill Professional,2009
191,Digital,OverDrive,EBOOK,2018,1,1,Alternate Realities,,C. J. Cherryh,"Fiction, Science Fiction","Penguin Group (USA), Inc.",2013
192,Digital,OverDrive,EBOOK,2018,1,1,Philosophy Made Simple,,Robert Hellenga,"Fiction, Literature","Hachette Digital, Inc.",2013
193,Digital,OverDrive,EBOOK,2018,1,3,Sparrow,,Sarah Moon,"Young Adult Fiction, Young Adult Literature","Scholastic, Inc. (US)",2017
194,Digital,OverDrive,EBOOK,2018,1,4,Blindness,,José Saramago,"Fiction, Literature",Houghton Mifflin Harcourt Trade and Reference,2011
198,Digital,OverDrive,EBOOK,2018,1,1,Runaway Man: A Mystery,,David Handler,"Fiction, Mystery",Macmillan Publishers,2015
200,Digital,OverDrive,EBOOK,2018,1,2,The Turning: Stories,,Tim Winton,"Fiction, Literature, Short Stories","Simon & Schuster, Inc.",2014
202,Digital,OverDrive,EBOOK,2018,1,52,Don't Let Go,,Harlan Coben,"Fiction, Suspense, Thriller","Penguin Group (USA), Inc.",2017
203,Digital,OverDrive,EBOOK,2018,1,4,Straight from the Hip,,Susan  Mallery,"Fiction, Romance","Harlequin Enterprises, Ltd.",2009
204,Digital,OverDrive,EBOOK,2018,1,1,Enchanted No More,,Robin D. Owens,"Fantasy, Fiction, Romance","Harlequin Enterprises, Ltd.",2011
213,Digital,OverDrive,EBOOK,2018,1,1,"Sin and Sensibility: The Griffin Family Series, Book 1",,Suzanne Enoch,"Fiction, Historical Fiction, Romance",HarperCollins Publishers Inc.,2010
218,Digital,OverDrive,EBOOK,2018,1,1,Volume Four,,Brian James Freeman,"Fantasy, Fiction, Horror, Romance","Random House, Inc.",2017
219,Digital,OverDrive,EBOOK,2018,1,2,"The Minor Adjustment Beauty Salon: The No. 1 Ladies' Detective Agency Series, Book 14",,Alexander McCall Smith,"Fiction, Humor (Fiction), Mystery","Random House, Inc.",2013
229,Digital,OverDrive,EBOOK,2018,1,1,Max and Ruby at the Warthogs' Wedding,,Rosemary Wells,"Juvenile Fiction, Picture Book Fiction","Penguin Group (USA), Inc.",2015
231,Digital,OverDrive,EBOOK,2018,1,4,Shining City: A Novel,,Tom Rosenstiel,"Fiction, Thriller",HarperCollins Publishers Inc.,2017
233,Digital,OverDrive,EBOOK,2018,1,2,"The Theory of Death: Peter Decker / Rina Lazarus Series, Book 23",,Faye Kellerman,"Fiction, Mystery, Thriller",HarperCollins Publishers Inc.,2015
235,Digital,OverDrive,EBOOK,2018,1,1,Gunman's Rhapsody,,Robert B. Parker,"Fiction, Western","Penguin Group (USA), Inc.",2013
248,Digital,OverDrive,EBOOK,2018,1,1,"Borderlands: Inspector Benedict Devlin Series, Book 1",,Brian McGilloway,"Fiction, Mystery",Macmillan Publishers,2013
252,Digital,OverDrive,EBOOK,2018,1,4,The Legend Trilogy Collection,,Marie Lu,"Romance, Science Fiction & Fantasy, Young Adult Fiction, Young Adult Literature","Penguin Group (USA), Inc.",2014
270,Digital,OverDrive,EBOOK,2018,1,1,"Vicious Circle: Felix Castor Series, Book 2",,Mike Carey,"Fantasy, Fiction, Thriller","Hachette Digital, Inc.",2012
271,Digital,OverDrive,EBOOK,2018,1,1,365 Slow Cooker Suppers,,Stephanie O'Dea,"Cooking & Food, Nonfiction",Houghton Mifflin Harcourt Trade and Reference,2013
274,Digital,OverDrive,EBOOK,2018,1,1,"Footprints Under the Window: Hardy Boys Series, Book 12",,Franklin W. Dixon,"Juvenile Fiction, Mystery","Penguin Group (USA), Inc.",2011
277,Digital,OverDrive,EBOOK,2018,1,35,The Orphan Master's Son: A Novel,,Adam Johnson,"Fiction, Literature, Suspense, Thriller","Random House, Inc.",2012
280,Digital,OverDrive,EBOOK,2018,1,1,"The Titans: Kent Family Series, Book 5",,John Jakes,"Fiction, Literature",Open Road Integrated Media,2012
283,Digital,OverDrive,EBOOK,2018,1,1,Negocios: Spanish-language edition of Drown,,Junot Díaz,"Fiction, Literature, Short Stories","Random House, Inc.",2013
285,Digital,OverDrive,EBOOK,2018,1,16,The 100-Year-Old Man Who Climbed Out the Window and Disappeared,,Jonas Jonasson,"Fiction, Literature","Hachette Digital, Inc.",2012
291,Digital,OverDrive,EBOOK,2018,1,1,"The Moonstone and Miss Jones: Phaeton Black Series, Book 2",,Jillian Stone,"Fantasy, Fiction, Historical Fiction, Romance","Random House, Inc.",2012
293,Digital,OverDrive,EBOOK,2018,1,4,"Single, Carefree, Mellow: Stories",,Katherine Heiny,"Fiction, Humor (Fiction), Literature","Random House, Inc.",2015
317,Digital,OverDrive,EBOOK,2018,1,13,Radical Candor: Be a Kick-Ass Boss Without Losing Your Humanity,,Kim Scott,"Business, Nonfiction",Macmillan Publishers,2017
323,Digital,OverDrive,EBOOK,2018,1,1,Mathematical Footprints: Discovering Mathematics Everywhere,,Theoni Pappas,"Essays, Mathematics, Nonfiction, Science",Lightning Source Inc,2012
325,Digital,OverDrive,EBOOK,2018,1,1,Body of Work: Finding the Thread That Ties Your Story Together,,Pamela Slim,"Business, Nonfiction, Self-Improvement","Penguin Group (USA), Inc.",2014
328,Digital,OverDrive,EBOOK,2018,1,1,"Midnight Rambler: Jack Carpenter Series, Book 1",,James Swain,"Fiction, Mystery, Thriller","Random House, Inc.",2012
329,Digital,OverDrive,EBOOK,2018,1,3,"My Soul to Take: Thora Gudmundsdottir Series, Book 2",,Yrsa Sigurdardottir,"Fiction, Mystery",HarperCollins Publishers Inc.,2013
335,Digital,OverDrive,EBOOK,2018,1,2,The Man Who Broke Into Auschwitz: A True Story of World War II,,Denis Avey,"History, Military, Nonfiction",Perseus Books Group,2011
336,Digital,OverDrive,EBOOK,2018,1,1,"How to Eat Like a Hot Chick: Eat What You Love, Love How You Feel",,Jodi Lipper,"Health & Fitness, Nonfiction, Self-Improvement",HarperCollins Publishers Inc.,2008
337,Digital,OverDrive,EBOOK,2018,1,6,The Sirens of Titan,,Kurt Vonnegut,"Fiction, Literature, Science Fiction","Random House, Inc.",2011
349,Digital,OverDrive,EBOOK,2018,1,2,The Evil Inside,,Heather  Graham,"Fantasy, Fiction, Paranormal Romance","Harlequin Enterprises, Ltd.",2011
361,Digital,OverDrive,EBOOK,2018,1,1,"Flat Belly Diet! Diabetes: Lose Weight, Target Belly Fat, and Lower Blood Sugar with This Tested Plan from the Editors of Prevention",,Liz Vaccariello,"Health & Fitness, Nonfiction","Rodale, Inc.",2016
373,Digital,OverDrive,EBOOK,2018,1,2,"Working with Difficult People, Second Revised Edition: Handling the Ten Types of Problem People Without Losing Your Mind",,Amy Cooper Hakim,"Business, Nonfiction","Penguin Group (USA), Inc.",2017
374,Digital,OverDrive,EBOOK,2018,1,7,Victoria & Abdul,,Shrabani Basu,"Biography & Autobiography, History, Nonfiction, Politics","Random House, Inc.",2017
376,Digital,OverDrive,EBOOK,2018,1,3,Gone for Good,,Harlan Coben,"Fiction, Mystery, Suspense, Thriller","Random House, Inc.",2011
377,Digital,OverDrive,EBOOK,2018,1,7,The Singularity Is Near: When Humans Transcend Biology,,Ray Kurzweil,"Nonfiction, Science, Sociology, Technology","Penguin Group (USA), Inc.",2008
378,Digital,OverDrive,EBOOK,2018,1,5,"""F"" is for Fugitive: Kinsey Millhone Series, Book 6",,Sue Grafton,"Fiction, Mystery",Macmillan Publishers,2013
379,Digital,OverDrive,EBOOK,2018,1,2,"Damascus Countdown: David Shirazi Series, Book 3",,Joel C. Rosenberg,"Christian Fiction, Fiction, Suspense, Thriller",Tyndale House Publishers,2013
382,Digital,OverDrive,EBOOK,2018,1,5,Flight Behavior: A Novel,,Barbara Kingsolver,"Fiction, Literature",HarperCollins Publishers Inc.,2012
383,Digital,OverDrive,EBOOK,2018,1,11,"Matched: Matched Trilogy, Book 1",,Ally Condie,"Romance, Science Fiction & Fantasy, Young Adult Fiction, Young Adult Literature","Penguin Group (USA), Inc.",2011
384,Digital,OverDrive,EBOOK,2018,1,2,The Third Wave: An Entrepreneur's Vision of the Future,,Steve Case,"Biography & Autobiography, Business, Management, Nonfiction","Simon & Schuster, Inc.",2016
385,Digital,OverDrive,EBOOK,2018,1,1,Hex and the Single Girl,,Valerie Frankel,"Fiction, Humor (Fiction), Romance",HarperCollins Publishers Inc.,2007
386,Digital,OverDrive,EBOOK,2018,1,2,Witches Be Crazy,,Logan Hunder,"Fantasy, Fiction, Humor (Fiction)","Simon & Schuster, Inc.",2015
388,Digital,OverDrive,EBOOK,2018,1,1,The Price of Pleasure,,Connie Mason,"Fiction, Historical Fiction, Romance",Dorchester Publishing,2012
389,Digital,OverDrive,EBOOK,2018,1,3,Twilight of American Sanity: A Psychiatrist Analyzes the Age of Trump,,Allen Frances,"Nonfiction, Politics, Psychology",HarperCollins Publishers Inc.,2017
404,Digital,OverDrive,EBOOK,2018,1,2,The Sneetches and Other Stories,,Dr. Seuss,"Classic Literature, Juvenile Fiction","Random House, Inc.",2015
405,Digital,OverDrive,EBOOK,2018,1,1,The Berenstain Bears Forget Their Manners,,Stan and Jan Berenstain,Juvenile Fiction,childrensElibrary,2005
408,Digital,OverDrive,EBOOK,2018,1,4,What I Did for Love: A Novel,,Susan Elizabeth Phillips,"Fiction, Humor (Fiction), Romance",HarperCollins Publishers Inc.,2009
411,Digital,OverDrive,EBOOK,2018,1,2,Stand-in Groom,,Suzanne Brockmann,"Fiction, Romance, Suspense","Random House, Inc.",2009
414,Digital,OverDrive,EBOOK,2018,1,3,"Private Eyes: Alex Delaware Series, Book 6",,Jonathan Kellerman,"Fiction, Mystery, Suspense, Thriller","Random House, Inc.",2010
415,Digital,OverDrive,EBOOK,2018,1,2,The Mindful Path to Self-Compassion: Freeing Yourself from Destructive Thoughts and Emotions,,Christopher Germer,"Nonfiction, Psychology",Guilford Publications,2016
427,Digital,OverDrive,EBOOK,2018,1,3,"Murder on St. Mark's Place: Gaslight Mystery Series, Book 2",,Victoria Thompson,"Fiction, Mystery","Penguin Group (USA), Inc.",2013
443,Digital,OverDrive,EBOOK,2018,1,1,The Use of Man,,Aleksandar Tisma,"Fiction, Historical Fiction, Literature","Random House, Inc.",2014
449,Digital,OverDrive,EBOOK,2018,1,1,"Cheerful Money: Me, My Family, and the Last Days of Wasp Splendor",,Tad Friend,"Biography & Autobiography, Nonfiction","Hachette Digital, Inc.",2009
452,Digital,OverDrive,EBOOK,2018,1,2,"Eight Million Ways to Die: Matthew Scudder Series, Book 5",,Lawrence Block,"Fiction, Mystery",HarperCollins Publishers Inc.,2009
469,Digital,OverDrive,EBOOK,2018,1,3,Living Beautifully: with Uncertainty and Change,,Pema Chodron,"Nonfiction, Religion & Spirituality, Self-Improvement","Random House, Inc.",2014
471,Digital,OverDrive,EBOOK,2018,1,2,Baking with Less Sugar: Recipes for Desserts Using Natural Sweeteners and Little-to-No White Sugar,,Joanne Chang,"Cooking & Food, Nonfiction",Chronicle Books,2015
475,Digital,OverDrive,EBOOK,2018,1,3,"Clockwork Angel: Shadowhunters: The Infernal Devices Series, Book 1",,Cassandra Clare,"Fantasy, Young Adult Fiction","Simon & Schuster, Inc.",2014
478,Digital,OverDrive,EBOOK,2018,1,1,Barbie in a Mermaid Tale 2 Junior Novelization,,Molly McGuire,"Juvenile Fiction, Juvenile Literature","Random House, Inc.",2012
484,Digital,OverDrive,EBOOK,2018,1,2,Brain Bytes: Quick Answers to Quirky Questions About the Brain,,Eric Chudler,"Nonfiction, Psychology, Science",W. W. Norton & Company,2017
485,Digital,OverDrive,EBOOK,2018,1,2,The Adderall Diaries: A Memoir,,Stephen Elliott,"Biography & Autobiography, Nonfiction",Macmillan Publishers,2014
495,Digital,OverDrive,EBOOK,2018,1,2,All But My Life: A Memoir,,Gerda Weissmann Klein,"Biography & Autobiography, History, Nonfiction",Macmillan Publishers,2014
496,Digital,OverDrive,EBOOK,2018,1,1,The Berenstain Bears' Class Trip,,Jan Berenstain,"Beginning Reader, Juvenile Fiction, Juvenile Literature",HarperCollins Publishers Inc.,2016
505,Digital,OverDrive,EBOOK,2018,1,1,Bronze and Sunflower,,Cao WenXuan,"Juvenile Fiction, Juvenile Literature",Candlewick Press,2017
510,Digital,OverDrive,EBOOK,2018,1,18,Tears We Cannot Stop: A Sermon to White America,,Michael Eric Dyson,"Nonfiction, Politics, Sociology",Macmillan Publishers,2017
513,Digital,OverDrive,EBOOK,2018,1,1,"The Long Cosmos: Long Earth Series, Book 5",,Terry Pratchett,"Fiction, Literature, Science Fiction",HarperCollins Publishers Inc.,2016
514,Digital,OverDrive,EBOOK,2018,1,7,Landline: A Novel,,Rainbow Rowell,"Fiction, Literature",Macmillan Publishers,2014
517,Digital,OverDrive,EBOOK,2018,1,16,"Use of Force: Scot Harvath Series, Book 16",,Brad Thor,"Fiction, Suspense, Thriller","Simon & Schuster, Inc.",2017
521,Digital,OverDrive,EBOOK,2018,1,17,"The Ship of the Dead: Magnus Chase and the Gods of Asgard Series, Book 3",,Rick Riordan,"Juvenile Fiction, Juvenile Literature, Mythology",Disney Digital Books,2017
525,Digital,OverDrive,EBOOK,2018,1,2,"The Crowdsourceress: Get Smart, Get Funded, and Kickstart Your Next Big Idea",,Alex Daly,"Business, Computer Technology, Nonfiction","Hachette Digital, Inc.",2017
526,Digital,OverDrive,EBOOK,2018,1,1,"Obsidian Mirror: Chronoptika Series, Book 1",,Catherine Fisher,"Fantasy, Mythology, Science Fiction & Fantasy, Young Adult Fiction","Penguin Group (USA), Inc.",2013
528,Digital,OverDrive,EBOOK,2018,1,4,Homage to Catalonia,,George Orwell,"History, Nonfiction",Houghton Mifflin Harcourt Trade and Reference,2017
535,Digital,OverDrive,EBOOK,2018,1,2,The Lost Weekend,,Charles Jackson,"Classic Literature, Fiction, Literature","Random House, Inc.",2013
541,Digital,OverDrive,EBOOK,2018,1,2,The Color of Our Sky: A Novel,,Amita Trasi,"Fiction, Literature",HarperCollins Publishers Inc.,2017
543,Digital,OverDrive,EBOOK,2018,1,1,Curious George at the Aquarium / Jorge el Curioso Visita el Acuario,,H. A. Rey,"Juvenile Fiction, Picture Book Fiction",Houghton Mifflin Harcourt Trade and Reference,2017
555,Digital,OverDrive,EBOOK,2018,1,1,Mammal,,Steve Parker,"Juvenile Nonfiction, Nature",Dorling Kindersley Limited,2012
556,Digital,OverDrive,EBOOK,2018,1,4,"Track of the Cat: Anna Pigeon Series, Book 1",,Nevada Barr,"Fiction, Mystery","Penguin Group (USA), Inc.",2010
566,Digital,OverDrive,EBOOK,2018,1,2,"A Stranger at Fellsworth: Treasures of Surrey Series, Book 3",,Sarah E. Ladd,"Fiction, Historical Fiction, Romance",Thomas Nelson Inc.,2017
570,Digital,OverDrive,EBOOK,2018,1,2,Faeries Gone Wild,,MaryJanice Davidson,"Fantasy, Fiction, Romance",Macmillan Publishers,2013
572,Digital,OverDrive,EBOOK,2018,1,4,The Serpent King,,Jeff Zentner,"Young Adult Fiction, Young Adult Literature","Random House, Inc.",2016
573,Digital,OverDrive,EBOOK,2018,1,1,"Mystery of the Traveling Tomatoes: The Boxcar Children Series, Book 117",,Gertrude  Chandler Warner,"Juvenile Fiction, Mystery",Open Road Integrated Media,2012
574,Digital,OverDrive,EBOOK,2018,1,3,"Know Yourself, Forget Yourself: Five Truths to Transform Your Work, Relationships, and Everyday Life",,Marc Lesser,"New Age, Nonfiction",New World Library,2013
577,Digital,OverDrive,EBOOK,2018,1,2,"The House by the Lake: One House, Five Families, and a Hundred Years of German History",,Thomas Harding,"Biography & Autobiography, History, Nonfiction",Macmillan Publishers,2016
583,Digital,OverDrive,EBOOK,2018,1,1,"Poison Sleep: Marla Mason Series, Book 2",,Tim Pratt,"Fantasy, Fiction","Random House, Inc.",2008
586,Digital,OverDrive,EBOOK,2018,1,4,Happiness: The Crooked Little Road to Semi-Ever After,,Heather Harpham,"Biography & Autobiography, Nonfiction",Macmillan Publishers,2017
593,Digital,OverDrive,EBOOK,2018,1,1,"101 Great Résumés: Winning Résumés for Any Situation, Job, or Career (Third Edition)",,Ron Fry,"Business, Careers, Nonfiction",Open Road Integrated Media,2012
597,Digital,OverDrive,EBOOK,2018,1,4,The Negative Calorie Diet: 10 All You Can Eat Foods—10 Hard to Lose Pounds = 10 Life-Changing Days,,Rocco DiSpirito,"Cooking & Food, Health & Fitness, Nonfiction",HarperCollins Publishers Inc.,2015
601,Digital,OverDrive,EBOOK,2018,1,1,The Berenstain Bears' Christmas Tree,,Stan and Jan Berenstain w/ Mike Berenstain,"Juvenile Fiction, Picture Book Fiction",Zondervan,2010
610,Digital,OverDrive,EBOOK,2018,1,1,She of the Mountains,,Vivek Shraya,"Fiction, Literature",Lightning Source Inc,2014
613,Digital,OverDrive,EBOOK,2018,1,1,Creature Keepers and the Perilous Pyro-Paws,,Peter Nelson,"Humor (Fiction), Juvenile Fiction, Juvenile Literature",HarperCollins Publishers Inc.,2017
626,Digital,OverDrive,EBOOK,2018,1,1,"The Paradise War: Song of Albion Series, Book 1",,Stephen Lawhead,"Fantasy, Fiction",Thomas Nelson Inc.,2011
632,Digital,OverDrive,EBOOK,2018,1,1,The Complete Outdoor Builder: From Arbors to Walkways,,Editors of CPi,"Crafts, Home Design & Décor, Nonfiction",Quarto Publishing Group USA,2010
634,Digital,OverDrive,EBOOK,2018,1,7,Spaceman of Bohemia,,Jaroslav Kalfar,"Fiction, Literature, Science Fiction","Hachette Digital, Inc.",2017
636,Digital,OverDrive,EBOOK,2018,1,1,The Man Who Ate His Boots: The Tragic History of the Search for the Northwest Passage,,Anthony Brandt,"History, Nonfiction","Random House, Inc.",2010
653,Digital,OverDrive,EBOOK,2018,1,1,"Obsession, Deceit and Really Dark Chocolate",,Kyra Davis,"Chick Lit, Fiction, Romance","Harlequin Enterprises, Ltd.",2012
658,Digital,OverDrive,EBOOK,2018,1,8,"Manners & Mutiny: Finishing School Series, Book 4",,Gail Carriger,"Fantasy, Historical Fiction, Young Adult Fiction","Hachette Digital, Inc.",2015
659,Digital,OverDrive,EBOOK,2018,1,2,The Known World,,Edward P. Jones,"African American Fiction, Fiction, Historical Fiction",HarperCollins Publishers Inc.,2006
661,Digital,OverDrive,EBOOK,2018,1,1,The Dosadi Experiment,,Frank Herbert,"Fiction, Science Fiction",Macmillan Publishers,2013
686,Digital,OverDrive,EBOOK,2018,1,2,"Ramona the Pest: Ramona Quimby Series, Book 2",,Beverly Cleary,"Juvenile Fiction, Juvenile Literature",HarperCollins Publishers Inc.,2008
693,Digital,OverDrive,EBOOK,2018,1,1,Citadel: A Novel,,Kate Mosse,"Fantasy, Fiction, Historical Fiction, Thriller",HarperCollins Publishers Inc.,2014
697,Digital,OverDrive,EBOOK,2018,1,4,Dead Letters: A Novel,,Caite Dolan-Leach,"Fiction, Literature, Suspense, Thriller","Random House, Inc.",2017
702,Digital,OverDrive,EBOOK,2018,1,1,"Sleeping with Fear: Fear Series, Book 3",,Kay Hooper,"Fiction, Mystery, Suspense, Thriller","Random House, Inc.",2011
703,Digital,OverDrive,EBOOK,2018,1,2,The Art of Mending: A Novel,,Elizabeth Berg,"Fiction, Literature","Random House, Inc.",2012
716,Digital,OverDrive,EBOOK,2018,1,2,"Fly Guy vs. the Flyswatter!: Fly Guy Series, Book 10",,Tedd Arnold,"Beginning Reader, Humor (Fiction), Juvenile Fiction, Picture Book Fiction","Scholastic, Inc. (US)",2015
719,Digital,OverDrive,EBOOK,2018,1,1,"The Sudden Arrival of Violence: Glasgow Trilogy, Book 3",,Malcolm Mackay,"Fiction, Mystery","Hachette Digital, Inc.",2015
725,Digital,OverDrive,EBOOK,2018,1,1,Skippy Dies: A Novel,,Paul Murray,"Fiction, Literature",Macmillan Publishers,2015
728,Digital,OverDrive,EBOOK,2018,1,1,How to Take the Grr out of Anger,,Elizabeth Verdick,"Children, Juvenile Nonfiction, Self-Improvement",Free Spirit Publishing,2012
729,Digital,OverDrive,EBOOK,2018,1,1,Midnight Without a Moon,,Linda Williams Jackson,"Historical Fiction, Juvenile Fiction",Houghton Mifflin Harcourt Trade and Reference,2017
733,Digital,OverDrive,EBOOK,2018,1,1,Mutants: On Genetic Variety and the Human Body,,Armand Marie Leroi,"Nonfiction, Science","Penguin Group (USA), Inc.",2013
737,Digital,OverDrive,EBOOK,2018,1,2,A Valentine Wedding,,Jane Feather,"Fiction, Historical Fiction, Humor (Fiction), Romance","Random House, Inc.",2011
740,Digital,OverDrive,EBOOK,2018,1,2,Seven Seasons in Siena: My Quixotic Quest for Acceptance Among Tuscany's Proudest People,,Robert Rodi,"Biography & Autobiography, Nonfiction, Sociology, Travel","Random House, Inc.",2012
741,Digital,OverDrive,EBOOK,2018,1,2,"Back in Time: Geronimo Stilton Journey Through Time Series, Book 2",,Geronimo Stilton,"Juvenile Fiction, Juvenile Literature","Scholastic, Inc. (US)",2015
