,usageclass,checkouttype,materialtype,checkoutyear,checkoutmonth,checkouts,title,isbn,creator,subjects,publisher,publicationyear
4665,Digital,OverDrive,EBOOK,2018,1,1,Islands of Destiny: The Solomons Campaign and the Eclipse of the Rising Sun,,John Prados,"History, Military, Nonfiction","Penguin Group (USA), Inc.",2013
4668,Digital,OverDrive,EBOOK,2018,1,3,Dead Watch,,John Sandford,"Fiction, Thriller","Penguin Group (USA), Inc.",2011
4672,Digital,OverDrive,EBOOK,2018,1,5,Brain Maker: The Power of Gut Microbes to Heal and Protect Your Brain ¿ for Life,,David Perlmutter,"Health & Fitness, Nonfiction","Hachette Digital, Inc.",2015
4676,Digital,OverDrive,EBOOK,2018,1,7,The Passenger,,Lisa Lutz,"Fiction, Literature, Suspense, Thriller","Simon & Schuster, Inc.",2016
4683,Digital,OverDrive,EBOOK,2018,1,2,"One Summer Night: At the Shore Series, Book 1",,Caridad Pineiro,"Fiction, Romance",Sourcebooks,2017
4689,Digital,OverDrive,EBOOK,2018,1,3,"Ask the Cards a Question: Sharon McCone Mystery Series, Book 2",,Marcia Muller,"Fiction, Mystery","Blackstone Audio, Inc.",2013
4693,Digital,OverDrive,EBOOK,2018,1,7,Off the Charts: The Hidden Lives and Lessons of American Child Prodigies,,Ann Hulbert,"Education, Nonfiction, Psychology, Sociology","Random House, Inc.",2018
4694,Digital,OverDrive,EBOOK,2018,1,1,You're Saying It Wrong: A Pronunciation Guide to the 150 Most Commonly Mispronounced Words—and TheirTangled Histories of Misuse,,Ross Petras,"Language Arts, Nonfiction, Sociology","Random House, Inc.",2016
4701,Digital,OverDrive,EBOOK,2018,1,1,The Morels,,Christopher Hacker,"Fiction, Literature","Random House, Inc.",2013
4705,Digital,OverDrive,EBOOK,2018,1,2,"Navigators of Dune: Great Schools of Dune Series, Book 3",,Brian Herbert,"Fiction, Science Fiction",Macmillan Publishers,2016
4712,Digital,OverDrive,EBOOK,2018,1,1,The Practical Distiller,,Samuel McHarry,"Cooking & Food, Nonfiction, Reference",Andrews UK Limited,2010
4716,Digital,OverDrive,EBOOK,2018,1,1,And Man Created God: A History of the World at the Time of Jesus,,Selina O'Grady,"History, Nonfiction, Religion & Spirituality",Macmillan Publishers,2014
4721,Digital,OverDrive,EBOOK,2018,1,2,"In Your Corner: Redemption Series, Book 2",,Sarah Castille,"Erotic Literature, Fiction, Romance",Sourcebooks,2014
4722,Digital,OverDrive,EBOOK,2018,1,2,The Three Stigmata of Palmer Eldritch,,Philip K. Dick,"Fiction, Science Fiction",Houghton Mifflin Harcourt Trade and Reference,2017
4724,Digital,OverDrive,EBOOK,2018,1,1,The Right Time,,Lane Hayes,"Fiction, Literature, Romance",Dreamspinner Press,2015
4728,Digital,OverDrive,EBOOK,2018,1,1,"Compelling Evidence: Paul Madriani Series, Book 1",,Steve Martini,"Fiction, Thriller","Penguin Group (USA), Inc.",2013
4731,Digital,OverDrive,EBOOK,2018,1,1,Cagney,,John McCabe,"Biography & Autobiography, Nonfiction, Performing Arts","Random House, Inc.",2013
4736,Digital,OverDrive,EBOOK,2018,1,1,"The Highwayman: Saga of the First King, Book 1",,R. A. Salvatore,"Fantasy, Fiction",Macmillan Publishers,2013
4741,Digital,OverDrive,EBOOK,2018,1,1,Reign of Madness,,Lynn Cullen,"Fiction, Historical Fiction","Penguin Group (USA), Inc.",2011
4749,Digital,OverDrive,EBOOK,2018,1,1,Trucks,,Clive Gifford,"Juvenile Nonfiction, Transportation",Crabtree Publishing,2012
4754,Digital,OverDrive,EBOOK,2018,1,1,McGraw-Hill's Conquering LSAT Logic Games,,Curvebreakers,"Nonfiction, Study Aids & Workbooks",McGraw-Hill Professional,2010
4757,Digital,OverDrive,EBOOK,2018,1,7,The Stolen Marriage: A Novel,,Diane Chamberlain,"Fiction, Historical Fiction, Literature, Mystery",Macmillan Publishers,2017
4759,Digital,OverDrive,EBOOK,2018,1,2,"The Desperate Game: Guinevere Jones Series, Book 1",,Jayne Castle,"Fiction, Mystery","Penguin Group (USA), Inc.",2014
4764,Digital,OverDrive,EBOOK,2018,1,3,"The Monogram Murders: New Hercule Poirot Mystery Series, Book 1",,Sophie Hannah,"Fiction, Historical Fiction, Mystery, Thriller",HarperCollins Publishers Inc.,2014
4772,Digital,OverDrive,EBOOK,2018,1,2,Black Stats: African Americans by the Numbers in the Twenty-first Century,,Monique Morris,"Nonfiction, Sociology",Lightning Source Inc,2017
4786,Digital,OverDrive,EBOOK,2018,1,2,"Coyote's Mate: Breeds Series, Book 18",,Lora Leigh,"Erotic Literature, Fantasy, Fiction","Penguin Group (USA), Inc.",2009
4787,Digital,OverDrive,EBOOK,2018,1,2,It Takes Two: Our Story,,Jonathan Scott,"Biography & Autobiography, Nonfiction",Houghton Mifflin Harcourt Trade and Reference,2017
4788,Digital,OverDrive,EBOOK,2018,1,1,Old Glory: A Voyage Down the Mississippi,,Jonathan Raban,"Nonfiction, Travel","Random House, Inc.",2011
4790,Digital,OverDrive,EBOOK,2018,1,1,The Good Man of Nanking: The Diaries of John Rabe,,John Rabe,"Fiction, History, Literary Anthologies, Military","Random House, Inc.",2012
4792,Digital,OverDrive,EBOOK,2018,1,2,Lucky Broken Girl,,Ruth Behar,"Historical Fiction, Juvenile Fiction","Penguin Group (USA), Inc.",2017
4793,Digital,OverDrive,EBOOK,2018,1,1,Nice Is Just a Place in France: How to Win at Basically Everything,,The Betches,"Humor (Nonfiction), Nonfiction, Self-Improvement","Simon & Schuster, Inc.",2014
4794,Digital,OverDrive,EBOOK,2018,1,7,"A Peace Divided: Peacekeeper Series, Book 2",,Tanya Huff,"Fiction, Science Fiction","Penguin Group (USA), Inc.",2017
4797,Digital,OverDrive,EBOOK,2018,1,1,"Sabotaged: The Missing Series, Book 3",,Margaret Peterson Haddix,"Juvenile Fiction, Science Fiction","Simon & Schuster, Inc.",2014
4798,Digital,OverDrive,EBOOK,2018,1,3,"The Hormone Cure: Reclaim Balance, Sleep, Sex Drive and Vitality Naturally with the Gottfried Protocol",,Sara Gottfried,"Health & Fitness, Nonfiction","Simon & Schuster, Inc.",2014
4800,Digital,OverDrive,EBOOK,2018,1,1,Charm Offensive: How China's Soft Power Is Transforming the World,,Joshua Kurlantzick,"Current Events, Nonfiction",Yale University Press,2007
4803,Digital,OverDrive,EBOOK,2018,1,1,"Christmas with Holly: Friday Harbor Series, Book 1",,Lisa Kleypas,"Fiction, Romance",Macmillan Publishers,2013
4804,Digital,OverDrive,EBOOK,2018,1,2,"The Business Owner's Guide to Reading and Understanding Financial Statements: How to Budget, Forecast, and Monitor Cash Flow for Better Decision Making",,Lita Epstein,"Business, Nonfiction","John Wiley & Sons, Inc.",2012
4810,Digital,OverDrive,EBOOK,2018,1,1,"Crazy Is My Superpower: How I Triumphed by Breaking Bones, Breaking Hearts, and Breaking the Rules",,A. J. Mendez,"Biography & Autobiography, Nonfiction, Psychology, Sports & Recreations","Random House, Inc.",2017
4812,Digital,OverDrive,EBOOK,2018,1,1,"The Madhouse Effect: How Climate Change Denial Is Threatening Our Planet, Destroying Our Politics, and Driving Us Crazy",,Michael E. Mann,"Nonfiction, Science",Lightning Source Inc,2016
4815,Digital,OverDrive,EBOOK,2018,1,2,"Wolf's Clothing: Legend Tripping, Book 2",,E.J. Russell,"Fantasy, Fiction, Romance",Riptide Publishing,2016
4820,Digital,OverDrive,EBOOK,2018,1,1,Ramona,,Helen Hunt Jackson,"Classic Literature, Fiction","Penguin Group (USA), Inc.",2009
4821,Digital,OverDrive,EBOOK,2018,1,4,Daughter of the God-King,,Anne Cleeland,"Fiction, Historical Fiction",Sourcebooks,2013
4830,Digital,OverDrive,EBOOK,2018,1,1,Nocturnal,,Jacquelyn Frank,"Fantasy, Fiction, Romance, Short Stories","Random House, Inc.",2011
4835,Digital,OverDrive,EBOOK,2018,1,3,"Reader and Raelynx: Twelve Houses Series, Book 4",,Sharon Shinn,"Fantasy, Fiction","Penguin Group (USA), Inc.",2011
4838,Digital,OverDrive,EBOOK,2018,1,3,The Miraculous Journey of Edward Tulane,,Kate DiCamillo,"Juvenile Fiction, Juvenile Literature",Candlewick Press,2009
4839,Digital,OverDrive,EBOOK,2018,1,1,"Keeping It Hot: The Breakfast in Bed Series, Book 1",,Sydney Landon,"Fiction, Humor (Fiction), Literature, Romance","Penguin Group (USA), Inc.",2017
4841,Digital,OverDrive,EBOOK,2018,1,2,Can't Just Stop: An Investigation of Compulsions,,Sharon Begley,"Nonfiction, Psychology","Simon & Schuster, Inc.",2017
4842,Digital,OverDrive,EBOOK,2018,1,2,"Death in Brittany: Commissioner Dupin Series, Book 2",,Jean-Luc Bannalec,"Fiction, Mystery",Macmillan Publishers,2015
4848,Digital,OverDrive,EBOOK,2018,1,1,"Miranda the Beauty Fairy: Rainbow Magic: The Fashion Fairies Series, Book 1",,Daisy Meadows,"Juvenile Fiction, Juvenile Literature","Scholastic, Inc. (US)",2014
4849,Digital,OverDrive,EBOOK,2018,1,3,The New Rules of Work: The Modern Playbook for Navigating Your Career,,Alexandra Cavoulacos,"Business, Careers, Economics, Nonfiction","Random House, Inc.",2017
4851,Digital,OverDrive,EBOOK,2018,1,2,"First Drop of Crimson: Night Huntress World Series, Book 1",,Jeaniene Frost,"Fantasy, Fiction, Romance",HarperCollins Publishers Inc.,2010
4869,Digital,OverDrive,EBOOK,2018,1,1,The Misbehavior of Markets: A Fractal View of Financial Turbulence,,Benoit Mandelbrot,"Business, Nonfiction","Hachette Digital, Inc.",2011
4879,Digital,OverDrive,EBOOK,2018,1,5,"Girl, Interrupted",,Susanna Kaysen,"Biography & Autobiography, Nonfiction, Psychology, Sociology","Random House, Inc.",2013
4880,Digital,OverDrive,EBOOK,2018,1,1,"A Grave Denied: Kate Shugak Series, Book 13",,Dana Stabenow,"Fiction, Mystery",Macmillan Publishers,2013
4887,Digital,OverDrive,EBOOK,2018,1,2,"Discovery of Desire: London Explorers Series, Book 2",,Susanne Lord,"Fiction, Historical Fiction, Romance",Sourcebooks,2016
4901,Digital,OverDrive,EBOOK,2018,1,1,Selected Stories of H. G. Wells,,H.G. Wells,"Fiction, Science Fiction, Short Stories, Thriller","Random House, Inc.",2010
4902,Digital,OverDrive,EBOOK,2018,1,3,American Childhood,,Annie Dillard,"Biography & Autobiography, Nonfiction",HarperCollins Publishers Inc.,2007
4903,Digital,OverDrive,EBOOK,2018,1,2,"The Homecoming: Shelter Bay Series, Book 1",,Joann Ross,"Fiction, Romance, Suspense","Penguin Group (USA), Inc.",2010
4918,Digital,OverDrive,EBOOK,2018,1,4,Welcome to the Monkey House,,Kurt Vonnegut,"Fiction, Literature, Short Stories","Random House, Inc.",2011
4921,Digital,OverDrive,EBOOK,2018,1,1,"Ghost Times Two: Bailey Ruth Series, Book 7",,Carolyn Hart,"Fiction, Mystery","Penguin Group (USA), Inc.",2016
4934,Digital,OverDrive,EBOOK,2018,1,2,Havana Lunar,,Robert Arellano,"Fiction, Literature, Mystery",Lightning Source Inc,2010
4939,Digital,OverDrive,EBOOK,2018,1,1,Donovan: America's Master Spy,,William Stephenson,"Biography & Autobiography, Military, Nonfiction",Lightning Source Inc,2016
4943,Digital,OverDrive,EBOOK,2018,1,7,"To Catch An Heiress: Agents for the Crown Series, Book 1",,Julia Quinn,"Fiction, Historical Fiction, Humor (Fiction), Romance",HarperCollins Publishers Inc.,2005
4952,Digital,OverDrive,EBOOK,2018,1,1,Atlantis and Other Places: Stories of Alternate History,,Harry Turtledove,"Fiction, Historical Fiction, Science Fiction, Short Stories","Penguin Group (USA), Inc.",2010
4961,Digital,OverDrive,EBOOK,2018,1,2,Big Agenda: President Trumps Plan to Save America,,David Horowitz,"Nonfiction, Politics",Lightning Source Inc,2017
4963,Digital,OverDrive,EBOOK,2018,1,6,"Will's True Wish: True Gentlemen Series, Book 3",,Grace Burrowes,"Fiction, Historical Fiction, Romance",Sourcebooks,2017
4964,Digital,OverDrive,EBOOK,2018,1,1,Under the Lights,,Shannon Stacey,"Fiction, Literature, Romance","Penguin Group (USA), Inc.",2015
4969,Digital,OverDrive,EBOOK,2018,1,2,"Wild Card: Elite Ops Series, Book 1",,Lora Leigh,"Fiction, Romance, Suspense",Macmillan Publishers,2013
4975,Digital,OverDrive,EBOOK,2018,1,1,"To Rescue Tanelorn: Chronicles of the Last Emperor of Melniboné, Volume 2",,Michael Moorcock,"Fantasy, Fiction","Random House, Inc.",2011
4984,Digital,OverDrive,EBOOK,2018,1,13,"One Nation After Trump: A Guide for the Perplexed, the Disillusioned, the Desperate, and the Not-Yet Deported",,"E.J. Dionne, Jr.","Nonfiction, Politics",Macmillan Publishers,2017
4985,Digital,OverDrive,EBOOK,2018,1,3,Sweet Sleep: Nighttime and Naptime Strategies for the Breastfeeding Family,,La Leche League International,"Health & Fitness, Nonfiction","Random House, Inc.",2014
4995,Digital,OverDrive,EBOOK,2018,1,2,"The Thunder Keeper: Father John and Vicky Holden Series, Book 7",,Margaret Coel,"Fiction, Mystery","Penguin Group (USA), Inc.",2013
5003,Digital,OverDrive,EBOOK,2018,1,3,The Muse: A Novel,,Jessie Burton,"Fiction, Historical Fiction, Literature, Thriller",HarperCollins Publishers Inc.,2016
5007,Digital,OverDrive,EBOOK,2018,1,1,"Quinn: Eve Duncan Series, Book 13",,Iris Johansen,"Fiction, Thriller",Macmillan Publishers,2013
5014,Digital,OverDrive,EBOOK,2018,1,4,Two Flappers in Paris,,A. Cantab,"Erotic Literature, Fiction",Duke Classics,2018
5017,Digital,OverDrive,EBOOK,2018,1,1,The Shattered Gates: The Rifter Book One,,Ginn Hale,"Fantasy, Fiction, Literature","Smashwords, Inc.",2016
5019,Digital,OverDrive,EBOOK,2018,1,1,Ten Rules for Living with My Sister,,Ann M. Martin,Juvenile Fiction,Macmillan Publishers,2013
5030,Digital,OverDrive,EBOOK,2018,1,2,Gilded Cage,,Vic James,"Fantasy, Fiction, Science Fiction","Random House, Inc.",2017
5031,Digital,OverDrive,EBOOK,2018,1,1,"In Search of Lost Time, Volume V: The Captive & The Fugitive",,Marcel Proust,"Classic Literature, Fiction, Literature","Random House, Inc.",2010
5032,Digital,OverDrive,EBOOK,2018,1,1,"The Fix-It Friends--Three's a Crowd: The Fix-It Friends Series, Book 6",,Nicole C. Kear,"Juvenile Fiction, Juvenile Literature",Macmillan Publishers,2018
5034,Digital,OverDrive,EBOOK,2018,1,1,Bones and the Math Test Mystery,,David A. Adler,"Beginning Reader, Juvenile Fiction, Mystery","Penguin Group (USA), Inc.",2015
5035,Digital,OverDrive,EBOOK,2018,1,4,Odd Girl Out,,Ann Bannon,"Fiction, Literature, Romance","Simon & Schuster, Inc.",2013
5036,Digital,OverDrive,EBOOK,2018,1,2,"I Kissed an Earl: Pennyroyal Green Series, Book 4",,Julie Anne Long,"Fiction, Historical Fiction, Romance",HarperCollins Publishers Inc.,2010
5037,Digital,OverDrive,EBOOK,2018,1,2,Olympic Mountains Trail Guide: National Park and National Forest,,Robert Wood,"Nonfiction, Sports & Recreations",Mountaineers Books,2015
5042,Digital,OverDrive,EBOOK,2018,1,1,"A Woman of Substance: Emma Harte Series, Book 1",,Barbara Taylor Bradford,"Fiction, Literature",RosettaBooks,2014
5047,Digital,OverDrive,EBOOK,2018,1,1,"Skylark: Sarah, Plain and Tall Series, Book 2",,Patricia MacLachlan,"Historical Fiction, Juvenile Fiction",HarperCollins Publishers Inc.,2013
5051,Digital,OverDrive,EBOOK,2018,1,5,"Rose Harbor in Bloom: Rose Harbor Series, Book 2",,Debbie Macomber,"Fiction, Romance","Random House, Inc.",2013
5053,Digital,OverDrive,EBOOK,2018,1,1,"The Feminist Revolution: A Story of the Three Most Inspiring and Empowering Women in American History: Susan B. Anthony, Margaret Sanger, and Betty Friedan",,Jules Archer,"Biography & Autobiography, History, Juvenile Nonfiction, Reference",Lightning Source Inc,2015
5069,Digital,OverDrive,EBOOK,2018,1,3,Why Read Moby-Dick?,,Nathaniel Philbrick,"History, Nonfiction","Penguin Group (USA), Inc.",2011
5072,Digital,OverDrive,EBOOK,2018,1,1,"Nicholas St. North and the Battle of the Nightmare: Guardians of Childhood Series, Book 1",,William Joyce,"Folklore, Juvenile Fiction, Juvenile Literature, Mythology","Simon & Schuster, Inc.",2014
5079,Digital,OverDrive,EBOOK,2018,1,2,Charged: A Saints of Denver Novel,,Jay Crownover,"Fiction, Romance",HarperCollins Publishers Inc.,2016
5081,Digital,OverDrive,EBOOK,2018,1,1,Inheriting the Trade: A Northern Family Confronts Its Legacy as the Largest Slave-Trading,,Thomas Norman DeWolf,"Biography & Autobiography, History, Nonfiction, Sociology","Random House, Inc.",2008
5085,Digital,OverDrive,EBOOK,2018,1,5,The Chickenshit Club: Why the Justice Department Fails to Prosecute Executives,,Jesse Eisinger,"Business, Nonfiction, Politics","Simon & Schuster, Inc.",2017
5088,Digital,OverDrive,EBOOK,2018,1,1,"Anne's House of Dreams: Anne of Green Gables Series, Book 5",,L. Montgomery,"Classic Literature, Juvenile Fiction",ePenguin,2010
5091,Digital,OverDrive,EBOOK,2018,1,1,The Complete Idiot's Guide to Self-Sufficient Living,,Jerome D. Belanger,"Nonfiction, Reference","Penguin Group (USA), Inc.",2010
5094,Digital,OverDrive,EBOOK,2018,1,1,In the Spirit of Happiness,,Monks of New Skete,"Nonfiction, Religion & Spirituality","Hachette Digital, Inc.",2013
5103,Digital,OverDrive,EBOOK,2018,1,1,The Way of Boys: Raising Healthy Boys in a Challenging and Complex World,,"Anthony Rao, PhD","Nonfiction, Psychology",HarperCollins Publishers Inc.,2009
5106,Digital,OverDrive,EBOOK,2018,1,3,"Tycoon: Knickerbocker Club Series, Book 1",,Joanna Shupe,"Fiction, Historical Fiction, Romance, Short Stories","Random House, Inc.",2017
5119,Digital,OverDrive,EBOOK,2018,1,1,Windows Vista Just the Steps For Dummies,,Nancy C. Muir,"Computer Technology, Nonfiction","John Wiley & Sons, Inc.",2007
5122,Digital,OverDrive,EBOOK,2018,1,2,Selected Stories,,O. Henry,"Fiction, Short Stories","Penguin Group (USA), Inc.",2013
5126,Digital,OverDrive,EBOOK,2018,1,3,Whip Smart: A Memoir,,Melissa Febos,"Biography & Autobiography, Nonfiction",Macmillan Publishers,2013
5137,Digital,OverDrive,EBOOK,2018,1,1,Birds: Explore the world of our feathered friends,,DK,"Juvenile Nonfiction, Nature, Reference, Science",Dorling Kindersley Limited,2017
5138,Digital,OverDrive,EBOOK,2018,1,1,"My First New York: Early Adventures in the Big City (As Remembered by Actors, Artists, Athletes, Chefs, Comedians, Filmmakers, Mayors, Models, Moguls, Porn Stars, Rockers, Writers, and Others)",,New York Magazine,"Nonfiction, Travel",HarperCollins Publishers Inc.,2013
5142,Digital,OverDrive,EBOOK,2018,1,2,"Blood Test: Alex Delaware Series, Book 2",,Jonathan Kellerman,"Fiction, Literature","Simon & Schuster, Inc.",2014
5147,Digital,OverDrive,EBOOK,2018,1,2,"Breathe, Mama, Breathe: 5-Minute Mindfulness for Busy Moms",,Shonda Moralis,"Family & Relationships, New Age, Nonfiction, Self-Improvement",Workman Publishing,2017
5157,Digital,OverDrive,EBOOK,2018,1,2,"Guilt by Degrees: Rachel Knight Series, Book 2",,Marcia Clark,"Fiction, Thriller","Hachette Digital, Inc.",2013
5158,Digital,OverDrive,EBOOK,2018,1,1,Unquiet Ghosts: A Novel,,Glenn Meade,"Fiction, Thriller","Simon & Schuster, Inc.",2017
5161,Digital,OverDrive,EBOOK,2018,1,4,"Exile: Keeper of the Lost Cities Series, Book 2",,Shannon Messenger,"Fantasy, Juvenile Fiction","Simon & Schuster, Inc.",2014
5165,Digital,OverDrive,EBOOK,2018,1,1,The Time of the Ghost,,Diana Wynne Jones,"Fantasy, Young Adult Fiction",HarperCollins Publishers Inc.,2012
5181,Digital,OverDrive,EBOOK,2018,1,1,Rites of Passage,,Joy N. Hensley,"Romance, Young Adult Fiction, Young Adult Literature",HarperCollins Publishers Inc.,2014
5182,Digital,OverDrive,EBOOK,2018,1,5,Tara Road,,Maeve Binchy,"Fiction, Literature","Random House, Inc.",2009
5193,Digital,OverDrive,EBOOK,2018,1,1,"The Shadow Throne: The Shadow Campaigns Series, Book 2",,Django Wexler,"Fantasy, Fiction, Literature, Thriller","Penguin Group (USA), Inc.",2014
5201,Digital,OverDrive,EBOOK,2018,1,4,Means of Ascent: The Years of Lyndon Johnson II,,Robert A. Caro,"Biography & Autobiography, Nonfiction, Politics","Random House, Inc.",2012
5202,Digital,OverDrive,EBOOK,2018,1,1,The Harry's Bar Cookbook: Recipes and Reminiscences from the World-Famous Venice Bar and Restaurant,,Harry Cipriani,"Cooking & Food, Nonfiction, Travel","Random House, Inc.",2012
5217,Digital,OverDrive,EBOOK,2018,1,2,Phantom Pains,,Mishell Baker,"Fantasy, Fiction, Mystery, Mythology","Simon & Schuster, Inc.",2017
5218,Digital,OverDrive,EBOOK,2018,1,1,The Ultimate Ambition in the Arts of Erudition: A Compendium of Knowledge from the Classical Islamic World,,Shihab al-Din al-Nuwayri,"History, Nonfiction, Reference, Religion & Spirituality","Penguin Group (USA), Inc.",2016
5219,Digital,OverDrive,EBOOK,2018,1,3,Congo,,Michael Crichton,"Fiction, Suspense, Thriller","Random House, Inc.",2012
5222,Digital,OverDrive,EBOOK,2018,1,1,Diet for a Small Planet: The Book That Started a Revolution in the Way Americans Eat,,Frances Moore Lappe,"Cooking & Food, Essays, Nonfiction","Random House, Inc.",2010
5225,Digital,OverDrive,EBOOK,2018,1,1,"Dark Challenge: Dark Series, Book 5",,Christine Feehan,"Fantasy, Fiction, Romance",HarperCollins Publishers Inc.,2010
5227,Digital,OverDrive,EBOOK,2018,1,1,Terrorism and War,,Howard Zinn,"Human Rights, Nonfiction","GiantChair, Inc.",2010
5231,Digital,OverDrive,EBOOK,2018,1,3,Lucky Peach Presents Power Vegetables!: Turbocharged Recipes for Vegetables with Guts,,Peter Meehan,"Cooking & Food, Nonfiction, Reference","Random House, Inc.",2016
5242,Digital,OverDrive,EBOOK,2018,1,1,"The Shakespeare Stealer: Shakespeare Stealer Series, Book 1",,Gary Blackwood,"Historical Fiction, Juvenile Fiction","Penguin Group (USA), Inc.",2008
5243,Digital,OverDrive,EBOOK,2018,1,3,"Voice of the Violin: Inspector Montalbano Series, Book 4",,Andrea Camilleri,"Fiction, Mystery","Penguin Group (USA), Inc.",2010
5258,Digital,OverDrive,EBOOK,2018,1,4,"Wicked Charms: Wicked Series, Book 3",,Janet Evanovich,"Fantasy, Fiction, Mystery, Romance","Random House, Inc.",2015
5259,Digital,OverDrive,EBOOK,2018,1,2,"The Nun's Tale: Owen Archer Series, Book 3",,Candace Robb,"Fiction, Historical Fiction, Mystery",Diversion Books,2015
5260,Digital,OverDrive,EBOOK,2018,1,1,American Cocktail: 50 Recipes That Celebrate the Craft of Mixing Drinks From Coast to Coast,,Editors of Imbibe magazine,"Cooking & Food, Nonfiction",Chronicle Books,2012
5264,Digital,OverDrive,EBOOK,2018,1,1,"Lion, Tiger, and Bear",,Kate Ritchey,"Juvenile Nonfiction, Nature","Penguin Group (USA), Inc.",2015
5271,Digital,OverDrive,EBOOK,2018,1,1,Saving Simon: How a Rescue Donkey Taught Me the Meaning of Compassion,,Jon Katz,"Biography & Autobiography, Nonfiction, Pets, Philosophy","Random House, Inc.",2014
5276,Digital,OverDrive,EBOOK,2018,1,2,"The Circle: Grand & Batchelor Victorian Mystery Series, Book 2",,M. J. Trow,"Fiction, Historical Fiction, Mystery",Severn House Publishers Ltd,2016
5277,Digital,OverDrive,EBOOK,2018,1,3,To Rise Again at a Decent Hour: A Novel,,Joshua Ferris,"Fiction, Literature","Hachette Digital, Inc.",2014
5290,Digital,OverDrive,EBOOK,2018,1,3,Leprechaun in Late Winter,,Mary Pope Osborne,"Historical Fiction, Juvenile Fiction","Random House, Inc.",2011
5295,Digital,OverDrive,EBOOK,2018,1,1,Japanese Folk Plays: The Ink Smeared Lady and Other Kyogen: The Ink Smeared Lady and Other Kyogen,,Shio Sakanishi,"Drama, Fiction, Literary Anthologies",Lightning Source Inc,2012
5306,Digital,OverDrive,EBOOK,2018,1,4,Poison: A Novel,,Galt Niederhoffer,"Fiction, Literature, Thriller",Macmillan Publishers,2017
5309,Digital,OverDrive,EBOOK,2018,1,4,The Gifted Generation: When Government Was Good,,David Goldfield,"History, Nonfiction",Bloomsbury USA,2017
5312,Digital,OverDrive,EBOOK,2018,1,3,Bad Housekeeping: An Agnes and Effie Mystery,,Maia Chance,"Fiction, Mystery",Lightning Source Inc,2017
5317,Digital,OverDrive,EBOOK,2018,1,1,Half Moon Investigations,,Eoin Colfer,"Juvenile Fiction, Juvenile Literature, Mystery",Disney Digital Books,2011
5321,Digital,OverDrive,EBOOK,2018,1,1,John Muir Trail: The essential guide to hiking America's most famous trail,,Elizabeth Wenk,"Nonfiction, Sports & Recreations",Lightning Source Inc,2011
5331,Digital,OverDrive,EBOOK,2018,1,8,"Firelight: Amulet Series, Book 7",,Kazu Kibuishi,"Comic and Graphic Books, Juvenile Fiction","Scholastic, Inc. (US)",2016
5334,Digital,OverDrive,EBOOK,2018,1,2,"500 Vegan Recipes: An Amazing Variety of Delicious Recipes, From Chilis and Casseroles to Crumbles, Crisps, and Cookies",,Celine Steen,"Cooking & Food, Nonfiction",Quarto Publishing Group USA,2010
5337,Digital,OverDrive,EBOOK,2018,1,1,News from Nowhere and Other Writings,,William Morris,"Nonfiction, Sociology","Penguin Group (USA), Inc.",2011
5341,Digital,OverDrive,EBOOK,2018,1,4,Ulysses,,James Joyce,"Classic Literature, Fiction, Literature","Random House, Inc.",2010
5342,Digital,OverDrive,EBOOK,2018,1,1,Mutant Mantis Lunch Ladies: A Monstertown Mystery,,Bruce Hale,"Horror, Humor (Fiction), Juvenile Fiction, Mystery",Disney Digital Books,2017
5350,Digital,OverDrive,EBOOK,2018,1,2,Soar!: Build Your Vision from the Ground Up,,T. D. Jakes,"Nonfiction, Religion & Spirituality","Hachette Digital, Inc.",2017
5355,Digital,OverDrive,EBOOK,2018,1,1,"L.A. Confidential: L. A. Quartet, Book 3",,James Ellroy,"Fiction, Historical Fiction, Mystery","Hachette Digital, Inc.",2013
5358,Digital,OverDrive,EBOOK,2018,1,5,Stirring the Pot with Benjamin Franklin: A Founding Father's Culinary Adventures,,Rae Katherine Eighmey,"Biography & Autobiography, Cooking & Food, History, Nonfiction","Random House, Inc.",2018
5360,Digital,OverDrive,EBOOK,2018,1,1,The Legend of Sleepy Hollow,,Washington Irving,"Classic Literature, Mystery, Young Adult Fiction",childrensElibrary,2005
5363,Digital,OverDrive,EBOOK,2018,1,3,"The Modern Ayurvedic Cookbook: Healthful, Healing Recipes for Life",,Amrita Sondhi,"Cooking & Food, Nonfiction",Lightning Source Inc,2011
5368,Digital,OverDrive,EBOOK,2018,1,1,The Lion and the Crow,,Eli Easton,"Fiction, Historical Fiction, Romance",Dreamspinner Press,2015
5374,Digital,OverDrive,EBOOK,2018,1,5,A Course in Miracles: Original Edition,,Anonymous,"Nonfiction, Religion & Spirituality","BookMasters, Inc.",2010
5376,Digital,OverDrive,EBOOK,2018,1,1,I Was a Rat!,,Philip Pullman,"Folklore, Juvenile Fiction, Juvenile Literature","Random House, Inc.",2017
5379,Digital,OverDrive,EBOOK,2018,1,2,"Mrs. Master Is a Disaster!: My Weirdest School Series, Book 8",,Dan Gutman,"Humor (Fiction), Juvenile Fiction, Juvenile Literature",HarperCollins Publishers Inc.,2017
5385,Digital,OverDrive,EBOOK,2018,1,3,The Awakening: And Selected Short Stories,,Kate Chopin,"Fiction, Literary Anthologies, Literature, Short Stories",Duke Classics,2018
5387,Digital,OverDrive,EBOOK,2018,1,19,The Snow Child: A Novel,,Eowyn Ivey,"Fiction, Historical Fiction, Literature","Hachette Digital, Inc.",2013
5389,Digital,OverDrive,EBOOK,2018,1,1,Girl Factory: A Memoir,,Karen Dietrich,"Biography & Autobiography, Nonfiction",Rowman and Littlefield Publishing Group,2013
